,season,episodio,titolo,trama,guest_star,prima_visione,tags,luca,paolo,patty,patti,silvano,olmo,gloria,alex,caterina,lucrezia,anna,emma,de marinis,andrea,geller,vittorio,pippo,gaia,jessica,ilaria,valeria,wanda,giovanna,maria eleonara,carminati,title_trama
918,3,91,Dirty Dancing,Giovanna insegna ai colleghi d'ufficio a ballare.,,20 febbraio 2006,"['anna', 'giovanna']",0,0,0,0,0,0,0,0,0,0,1,0,0,0,0,0,0,0,0,0,0,0,1,0,0,Dirty Dancing Giovanna insegna ai colleghi d'ufficio a ballare.
919,3,92,Il premio di Paolo,Paolo ha ricevuto un premio di 1000 € e a Luca non va bene.,,20 febbraio 2006,"['luca', 'paolo']",1,1,0,0,0,0,0,0,0,0,0,0,0,0,0,0,0,0,0,0,0,0,0,0,0,Il premio di Paolo Paolo ha ricevuto un premio di 1000 € e a Luca non va bene.
920,3,93,La parte femminile degli uomini,Pippo cerca di far scoprire a Paolo la sua parte femminile.,,20 febbraio 2006,"['paolo', 'pippo']",0,1,0,0,0,0,0,0,0,0,0,0,0,0,0,0,1,0,0,0,0,0,0,0,0,La parte femminile degli uomini Pippo cerca di far scoprire a Paolo la sua parte femminile.
921,3,94,L'onore dei Bitta,Qualcuno ha parlato male della moglie di Paolo.,,20 febbraio 2006,['paolo'],0,1,0,0,0,0,0,0,0,0,0,0,0,0,0,0,0,0,0,0,0,0,0,0,0,L'onore dei Bitta Qualcuno ha parlato male della moglie di Paolo.
922,3,95,Pettegole,Patti spettegola con una dipendente della Digitex.,['Marica Coco'],20 febbraio 2006,['patti'],0,0,0,1,0,0,0,0,0,0,0,0,0,0,0,0,0,0,0,0,0,0,0,0,0,Pettegole Patti spettegola con una dipendente della Digitex.
923,3,96,Soprannomi,Luca non è contento del suo soprannome.,,20 febbraio 2006,['luca'],1,0,0,0,0,0,0,0,0,0,0,0,0,0,0,0,0,0,0,0,0,0,0,0,0,Soprannomi Luca non è contento del suo soprannome.
924,3,97,Tra due fuochi,Paolo si ritrova in mezzo ad un litigio tra Andrea e Vittorio.,,20 febbraio 2006,"['paolo', 'andrea', 'vittorio']",0,1,0,0,0,0,0,0,0,0,0,0,0,1,0,1,0,0,0,0,0,0,0,0,0,Tra due fuochi Paolo si ritrova in mezzo ad un litigio tra Andrea e Vittorio.
925,3,98,Vita di coppia,Alex diventa gelosa e possessiva nei confronti di Luca.,['Chiara Andreis'],20 febbraio 2006,"['luca', 'alex']",1,0,0,0,0,0,0,1,0,0,0,0,0,0,0,0,0,0,0,0,0,0,0,0,0,Vita di coppia Alex diventa gelosa e possessiva nei confronti di Luca.
926,3,99,Cimici,Olmo crede che in azienda ci siano delle microspie nascoste.,['Massimo Muntoni'],20 febbraio 2006,['olmo'],0,0,0,0,0,1,0,0,0,0,0,0,0,0,0,0,0,0,0,0,0,0,0,0,0,Cimici Olmo crede che in azienda ci siano delle microspie nascoste.
927,3,100,Emergenza Bitta,"Paolo ""prende in prestito"" un'ambulanza dall'officina di Pino.",,20 febbraio 2006,['paolo'],0,1,0,0,0,0,0,0,0,0,0,0,0,0,0,0,0,0,0,0,0,0,0,0,0,"Emergenza Bitta Paolo ""prende in prestito"" un'ambulanza dall'officina di Pino."
928,3,101,Il furto,Paolo non trova più la sua auto in azienda e crede siano stati i vigili a requisirla.,,20 febbraio 2006,['paolo'],0,1,0,0,0,0,0,0,0,0,0,0,0,0,0,0,0,0,0,0,0,0,0,0,0,Il furto Paolo non trova più la sua auto in azienda e crede siano stati i vigili a requisirla.
929,3,102,Il paese dei balocchi,"Silvano trova un magazzino pieno di vestiti abbandonati, ed ognuno dei dipendenti fa un salto lì per prendere qualcosa.",,20 febbraio 2006,['silvano'],0,0,0,0,1,0,0,0,0,0,0,0,0,0,0,0,0,0,0,0,0,0,0,0,0,"Il paese dei balocchi Silvano trova un magazzino pieno di vestiti abbandonati, ed ognuno dei dipendenti fa un salto lì per prendere qualcosa."
930,3,103,L'avventura di Luca,"Luca ha una breve avventura con una sconosciuta incontrata nel parcheggio dell'azienda, che poi si rivela essere la madre di Alex.",['Gabriella Franchini'],20 febbraio 2006,"['luca', 'alex']",1,0,0,0,0,0,0,1,0,0,0,0,0,0,0,0,0,0,0,0,0,0,0,0,0,"L'avventura di Luca Luca ha una breve avventura con una sconosciuta incontrata nel parcheggio dell'azienda, che poi si rivela essere la madre di Alex."
931,3,104,La pistola,Vittorio lascia la sua pistola incustodita in area relax.,,20 febbraio 2006,['vittorio'],0,0,0,0,0,0,0,0,0,0,0,0,0,0,0,1,0,0,0,0,0,0,0,0,0,La pistola Vittorio lascia la sua pistola incustodita in area relax.
932,3,106,Paolo assente,Luca e Silvano devono scassinare la cassettiera di Paolo.,,20 febbraio 2006,"['luca', 'paolo', 'silvano']",1,1,0,0,1,0,0,0,0,0,0,0,0,0,0,0,0,0,0,0,0,0,0,0,0,Paolo assente Luca e Silvano devono scassinare la cassettiera di Paolo.
933,3,107,Privacy,Alex rilascia un'intervista molto intima per una rivista femminile e Luca è preoccupato per la sua privacy.,,20 febbraio 2006,"['luca', 'alex']",1,0,0,0,0,0,0,1,0,0,0,0,0,0,0,0,0,0,0,0,0,0,0,0,0,Privacy Alex rilascia un'intervista molto intima per una rivista femminile e Luca è preoccupato per la sua privacy.
934,3,108,Uno scherzo di troppo,"Per vincere la noia dell'ufficio, Luca, Alex ed Olmo organizzano uno scherzo ai danni di Paolo, facendogli credere che è stato appena licenziato.",,20 febbraio 2006,"['luca', 'paolo', 'olmo', 'alex']",1,1,0,0,0,1,0,1,0,0,0,0,0,0,0,0,0,0,0,0,0,0,0,0,0,"Uno scherzo di troppo Per vincere la noia dell'ufficio, Luca, Alex ed Olmo organizzano uno scherzo ai danni di Paolo, facendogli credere che è stato appena licenziato."
935,3,109,Il frullato,Silvano crede che le ostriche siano afrodisiache.,,20 febbraio 2006,['silvano'],0,0,0,0,1,0,0,0,0,0,0,0,0,0,0,0,0,0,0,0,0,0,0,0,0,Il frullato Silvano crede che le ostriche siano afrodisiache.
936,3,110,Tecniche di vendita,Giovanna organizza una sfilata in intimo in modo da vendere più facilmente della biancheria intima.,,20 febbraio 2006,"['anna', 'giovanna']",0,0,0,0,0,0,0,0,0,0,1,0,0,0,0,0,0,0,0,0,0,0,1,0,0,Tecniche di vendita Giovanna organizza una sfilata in intimo in modo da vendere più facilmente della biancheria intima.
937,3,111,Auto sostitutiva,Paolo è costretto a guidare una macchina giapponese.,['Marco Ghirlandi'],20 febbraio 2006,['paolo'],0,1,0,0,0,0,0,0,0,0,0,0,0,0,0,0,0,0,0,0,0,0,0,0,0,Auto sostitutiva Paolo è costretto a guidare una macchina giapponese.
938,3,112,Esaurimento nervoso,A Wanda le è stato diagnosticato un esaurimento nervoso.,,20 febbraio 2006,['wanda'],0,0,0,0,0,0,0,0,0,0,0,0,0,0,0,0,0,0,0,0,0,1,0,0,0,Esaurimento nervoso A Wanda le è stato diagnosticato un esaurimento nervoso.
939,3,113,Il pappagallo,Paolo porta un pappagallo in azienda.,,20 febbraio 2006,['paolo'],0,1,0,0,0,0,0,0,0,0,0,0,0,0,0,0,0,0,0,0,0,0,0,0,0,Il pappagallo Paolo porta un pappagallo in azienda.
940,3,114,Il reggiseno,Luca e Paolo trovano un reggiseno nel bagno dell'area relax. Di chi sarà?,,20 febbraio 2006,"['luca', 'paolo']",1,1,0,0,0,0,0,0,0,0,0,0,0,0,0,0,0,0,0,0,0,0,0,0,0,Il reggiseno Luca e Paolo trovano un reggiseno nel bagno dell'area relax. Di chi sarà?
941,3,115,La password,Paolo ha dimenticato la password del suo computer.,,20 febbraio 2006,['paolo'],0,1,0,0,0,0,0,0,0,0,0,0,0,0,0,0,0,0,0,0,0,0,0,0,0,La password Paolo ha dimenticato la password del suo computer.
942,3,116,Riscaldamento,Problemi di riscaldamento in azienda.,,20 febbraio 2006,[],0,0,0,0,0,0,0,0,0,0,0,0,0,0,0,0,0,0,0,0,0,0,0,0,0,Riscaldamento Problemi di riscaldamento in azienda.
943,3,117,Il primo incontro di Luca e Paolo,"Con un salto indietro nel tempo, scopriamo come Luca e Paolo si conobbero per la prima volta in azienda: il suo primo giorno di lavoro Luca incontra per la prima volta il collega Paolo; a differenza di quanto si potrebbe pensare, i rapporti tra i due non saranno subito idilliaci.",,20 febbraio 2006,"['luca', 'paolo']",1,1,0,0,0,0,0,0,0,0,0,0,0,0,0,0,0,0,0,0,0,0,0,0,0,"Il primo incontro di Luca e Paolo Con un salto indietro nel tempo, scopriamo come Luca e Paolo si conobbero per la prima volta in azienda: il suo primo giorno di lavoro Luca incontra per la prima volta il collega Paolo; a differenza di quanto si potrebbe pensare, i rapporti tra i due non saranno subito idilliaci."
944,3,118,Il primo giorno di Patti,"Con un salto indietro nel tempo, scopriamo l'arrivo in azienda di Patti: assunta come segretaria di Ilaria, Patti viene immediatamente presa di mira da Luca e Paolo, che cercano subito di farle fare brutta figura con il suo nuovo capo, ma con Silvano è subito un colpo di fulmine",,20 febbraio 2006,"['luca', 'paolo', 'patti', 'silvano', 'ilaria']",1,1,0,1,1,0,0,0,0,0,0,0,0,0,0,0,0,0,0,1,0,0,0,0,0,"Il primo giorno di Patti Con un salto indietro nel tempo, scopriamo l'arrivo in azienda di Patti: assunta come segretaria di Ilaria, Patti viene immediatamente presa di mira da Luca e Paolo, che cercano subito di farle fare brutta figura con il suo nuovo capo, ma con Silvano è subito un colpo di fulmine"
945,3,119,Il primo giorno di Pippo,"Con un salto indietro nel tempo, scopriamo l'arrivo in azienda di Pippo: cacciato da De Marinis dalle selezioni per un posto da fattorino perché gay, Pippo in seguito salva involontariamente la vita al Presidente che, per ringraziarlo, ordina al direttore di assumerlo in azienda.",,20 febbraio 2006,"['de marinis', 'pippo']",0,0,0,0,0,0,0,0,0,0,0,0,1,0,0,0,1,0,0,0,0,0,0,0,0,"Il primo giorno di Pippo Con un salto indietro nel tempo, scopriamo l'arrivo in azienda di Pippo: cacciato da De Marinis dalle selezioni per un posto da fattorino perché gay, Pippo in seguito salva involontariamente la vita al Presidente che, per ringraziarlo, ordina al direttore di assumerlo in azienda."
946,3,120,Il primo giorno di De Marinis,"Con un salto indietro nel tempo, scopriamo come De Marinis divenne direttore dell'azienda: Augusto De Marinis è lo zimbello dell'ufficio, sempre preso in giro dai colleghi, fino a quando il direttore decide di vendere l'azienda e di porre agli acquirenti, come unica condizione alla riuscita dell'affare, la nomina di Augusto come nuovo direttore. De Marinis, una volta nominato capo, si prenderà così la sua ""vendetta"". Alla fine si scopre che l'ex-direttore era in realtà suo padre.",,20 febbraio 2006,['de marinis'],0,0,0,0,0,0,0,0,0,0,0,0,1,0,0,0,0,0,0,0,0,0,0,0,0,"Il primo giorno di De Marinis Con un salto indietro nel tempo, scopriamo come De Marinis divenne direttore dell'azienda: Augusto De Marinis è lo zimbello dell'ufficio, sempre preso in giro dai colleghi, fino a quando il direttore decide di vendere l'azienda e di porre agli acquirenti, come unica condizione alla riuscita dell'affare, la nomina di Augusto come nuovo direttore. De Marinis, una volta nominato capo, si prenderà così la sua ""vendetta"". Alla fine si scopre che l'ex-direttore era in realtà suo padre."
947,3,121,Il primo giorno di Giovanna,"Con un salto indietro nel tempo, scopriamo l'arrivo in azienda di Giovanna: la ragazza viene assunta al call center dell'azienda dopo che la precedente stagista se ne è andata alla Digitex, per colpa delle particolari ""attenzioni"" che De Marinis le riservava.",['Marica Coco'],8 marzo 2006,"['anna', 'de marinis', 'giovanna']",0,0,0,0,0,0,0,0,0,0,1,0,1,0,0,0,0,0,0,0,0,0,1,0,0,"Il primo giorno di Giovanna Con un salto indietro nel tempo, scopriamo l'arrivo in azienda di Giovanna: la ragazza viene assunta al call center dell'azienda dopo che la precedente stagista se ne è andata alla Digitex, per colpa delle particolari ""attenzioni"" che De Marinis le riservava."
948,3,122,Il primo giorno di Gaia,"Con un salto indietro nel tempo, scopriamo l'arrivo in azienda di Gaia: trasferita in azienda dalla filiale di Roma, Gaia resta subito affascinata dal modo di fare particolare e disincantato di Paolo, prima che Luca le faccia capire che in realtà è soltanto uno stupido.",,8 marzo 2006,"['luca', 'paolo', 'gaia']",1,1,0,0,0,0,0,0,0,0,0,0,0,0,0,0,0,1,0,0,0,0,0,0,0,"Il primo giorno di Gaia Con un salto indietro nel tempo, scopriamo l'arrivo in azienda di Gaia: trasferita in azienda dalla filiale di Roma, Gaia resta subito affascinata dal modo di fare particolare e disincantato di Paolo, prima che Luca le faccia capire che in realtà è soltanto uno stupido."
949,3,123,Il primo giorno di Olmo,"Con un salto indietro nel tempo, scopriamo l'arrivo in azienda di Olmo: presentatosi in azienda per un colloquio per il posto di fattorino, Olmo coglie al volo un'occasione presentatasi improvvisamente e, con uno stratagemma, si presenta a De Marinis per un posto di tecnico informatico.","['Federico Bonoconza ', ' Lorenzo De Marinis']",8 marzo 2006,"['olmo', 'emma', 'de marinis']",0,0,0,0,0,1,0,0,0,0,0,1,1,0,0,0,0,0,0,0,0,0,0,0,0,"Il primo giorno di Olmo Con un salto indietro nel tempo, scopriamo l'arrivo in azienda di Olmo: presentatosi in azienda per un colloquio per il posto di fattorino, Olmo coglie al volo un'occasione presentatasi improvvisamente e, con uno stratagemma, si presenta a De Marinis per un posto di tecnico informatico."
950,3,124,Il primo giorno di Andrea,"Con un salto indietro nel tempo, scopriamo l'arrivo in azienda di Andrea: passato in azienda per il posto da autista, Andrea viene inizialmente scartato da Luca (incaricato da De Marinis di fare la selezione dei candidati); ma dopo una lite in corridoio in cui Andrea butta al tappeto Paolo, De Marinis si convince ad assumerlo.",,8 marzo 2006,"['luca', 'paolo', 'de marinis', 'andrea']",1,1,0,0,0,0,0,0,0,0,0,0,1,1,0,0,0,0,0,0,0,0,0,0,0,"Il primo giorno di Andrea Con un salto indietro nel tempo, scopriamo l'arrivo in azienda di Andrea: passato in azienda per il posto da autista, Andrea viene inizialmente scartato da Luca (incaricato da De Marinis di fare la selezione dei candidati); ma dopo una lite in corridoio in cui Andrea butta al tappeto Paolo, De Marinis si convince ad assumerlo."
951,3,125,Il primo giorno di Paolo,"Con un salto indietro nel tempo, scopriamo l'arrivo in azienda di Paolo: al suo primo giorno di lavoro Paolo si presenta in ufficio vestito come Tony Manero, non riesce a capire bene a quale grado aziendale corrisponda il suo ruolo di Stagista Junior, e non perde occasione per fare il filo ad Ilaria.",,8 marzo 2006,"['paolo', 'ilaria']",0,1,0,0,0,0,0,0,0,0,0,0,0,0,0,0,0,0,0,1,0,0,0,0,0,"Il primo giorno di Paolo Con un salto indietro nel tempo, scopriamo l'arrivo in azienda di Paolo: al suo primo giorno di lavoro Paolo si presenta in ufficio vestito come Tony Manero, non riesce a capire bene a quale grado aziendale corrisponda il suo ruolo di Stagista Junior, e non perde occasione per fare il filo ad Ilaria."
952,3,126,Il primo giorno di Luca,"Con un salto indietro nel tempo, scopriamo l'arrivo in azienda di Luca: mentre è a capo di un sit-in di protesta davanti all'azienda, Luca, studente universitario fuoricorso, viene notato da De Marinis che, intuendone la furbizia e l'opportunismo, decide di assumerlo nel Reparto Acquisti.",['Gibba'],8 marzo 2006,"['luca', 'de marinis']",1,0,0,0,0,0,0,0,0,0,0,0,1,0,0,0,0,0,0,0,0,0,0,0,0,"Il primo giorno di Luca Con un salto indietro nel tempo, scopriamo l'arrivo in azienda di Luca: mentre è a capo di un sit-in di protesta davanti all'azienda, Luca, studente universitario fuoricorso, viene notato da De Marinis che, intuendone la furbizia e l'opportunismo, decide di assumerlo nel Reparto Acquisti."
953,3,127,Il primo giorno di Silvano,"Con un salto indietro nel tempo, scopriamo l'arrivo in azienda di Silvano: appena arrivato in azienda Silvano diventa subito la vittima preferita di Luca e Paolo.",,8 marzo 2006,"['luca', 'paolo', 'silvano']",1,1,0,0,1,0,0,0,0,0,0,0,0,0,0,0,0,0,0,0,0,0,0,0,0,"Il primo giorno di Silvano Con un salto indietro nel tempo, scopriamo l'arrivo in azienda di Silvano: appena arrivato in azienda Silvano diventa subito la vittima preferita di Luca e Paolo."
954,3,128,Il primo giorno di Alex,"Con un salto indietro nel tempo, scopriamo l'arrivo in azienda di Alex: dopo una settimana, Alex viene avvistata immediatamente da Luca e diventa l'oggetto del suo desiderio.",,8 marzo 2006,"['luca', 'alex']",1,0,0,0,0,0,0,1,0,0,0,0,0,0,0,0,0,0,0,0,0,0,0,0,0,"Il primo giorno di Alex Con un salto indietro nel tempo, scopriamo l'arrivo in azienda di Alex: dopo una settimana, Alex viene avvistata immediatamente da Luca e diventa l'oggetto del suo desiderio."
955,3,129,Panni sporchi,Luca chiede a Wanda di lavare per lui la biancheria di Alex.,,8 marzo 2006,"['luca', 'alex', 'wanda']",1,0,0,0,0,0,0,1,0,0,0,0,0,0,0,0,0,0,0,0,0,1,0,0,0,Panni sporchi Luca chiede a Wanda di lavare per lui la biancheria di Alex.
956,3,130,Qualcuno ci osserva,Olmo scopre che nel sistema informatico dell'azienda qualcuno ha installato un programma che permette di spiare tutte le conversazioni dei dipendenti.,,8 marzo 2006,['olmo'],0,0,0,0,0,1,0,0,0,0,0,0,0,0,0,0,0,0,0,0,0,0,0,0,0,Qualcuno ci osserva Olmo scopre che nel sistema informatico dell'azienda qualcuno ha installato un programma che permette di spiare tutte le conversazioni dei dipendenti.
957,3,131,Dr Jekyll e Miss Wanda,Wanda diventa improvvisamente intrattabile ed è continuamente isterica.,,8 marzo 2006,['wanda'],0,0,0,0,0,0,0,0,0,0,0,0,0,0,0,0,0,0,0,0,0,1,0,0,0,Dr Jekyll e Miss Wanda Wanda diventa improvvisamente intrattabile ed è continuamente isterica.
958,3,132,Sfida tra ruoli,Luca e Paolo non riescono a decidere chi dei due ha un ruolo più importante in azienda.,,8 marzo 2006,"['luca', 'paolo']",1,1,0,0,0,0,0,0,0,0,0,0,0,0,0,0,0,0,0,0,0,0,0,0,0,Sfida tra ruoli Luca e Paolo non riescono a decidere chi dei due ha un ruolo più importante in azienda.
959,3,133,La manovra di Heimlich,Silvano rischia di soffocare e ha bisogno della manovra di Heimlich.,,8 marzo 2006,['silvano'],0,0,0,0,1,0,0,0,0,0,0,0,0,0,0,0,0,0,0,0,0,0,0,0,0,La manovra di Heimlich Silvano rischia di soffocare e ha bisogno della manovra di Heimlich.
960,3,134,Film festival,Luca diventa giurato di un festival cinematografico e cerca di resistere alle seduzioni di un'attrice che vuole il premio.,['Veronika Logan'],8 marzo 2006,['luca'],1,0,0,0,0,0,0,0,0,0,0,0,0,0,0,0,0,0,0,0,0,0,0,0,0,Film festival Luca diventa giurato di un festival cinematografico e cerca di resistere alle seduzioni di un'attrice che vuole il premio.
961,3,135,Colloquio,Silvano ha l'opportunità di andare a lavorare per un'importante società di contabilità: Paolo cerca di aiutarlo a superare il colloquio.,,8 marzo 2006,"['paolo', 'silvano']",0,1,0,0,1,0,0,0,0,0,0,0,0,0,0,0,0,0,0,0,0,0,0,0,0,Colloquio Silvano ha l'opportunità di andare a lavorare per un'importante società di contabilità: Paolo cerca di aiutarlo a superare il colloquio.
962,3,136,Contaminazione,In azienda tutti credono che il nuovo stagista abbia la tubercolosi.,,8 marzo 2006,[],0,0,0,0,0,0,0,0,0,0,0,0,0,0,0,0,0,0,0,0,0,0,0,0,0,Contaminazione In azienda tutti credono che il nuovo stagista abbia la tubercolosi.
963,3,137,Tradimento,Patti crede che Silvano la tradisca con Gaia.,,8 marzo 2006,"['patti', 'silvano', 'gaia']",0,0,0,1,1,0,0,0,0,0,0,0,0,0,0,0,0,1,0,0,0,0,0,0,0,Tradimento Patti crede che Silvano la tradisca con Gaia.
964,3,138,Nella spazzatura,Silvano porta in azienda qualcosa che ha trovato nella spazzatura.,,8 marzo 2006,['silvano'],0,0,0,0,1,0,0,0,0,0,0,0,0,0,0,0,0,0,0,0,0,0,0,0,0,Nella spazzatura Silvano porta in azienda qualcosa che ha trovato nella spazzatura.
965,3,139,Crisi di pianto,Patti non riesce a smettere di piangere.,,8 marzo 2006,['patti'],0,0,0,1,0,0,0,0,0,0,0,0,0,0,0,0,0,0,0,0,0,0,0,0,0,Crisi di pianto Patti non riesce a smettere di piangere.
966,3,140,Il bicchiere rosso,"Gaia vince un viaggio a Parigi pescando il caffè col bicchiere rosso, e Paolo cerca in tutti i modi di pescare il secondo bicchiere.",,8 marzo 2006,"['paolo', 'gaia']",0,1,0,0,0,0,0,0,0,0,0,0,0,0,0,0,0,1,0,0,0,0,0,0,0,"Il bicchiere rosso Gaia vince un viaggio a Parigi pescando il caffè col bicchiere rosso, e Paolo cerca in tutti i modi di pescare il secondo bicchiere."
967,3,141,Camper Magazine,Luca rovina la copertina della rivista preferita di Paolo.,,8 marzo 2006,"['luca', 'paolo']",1,1,0,0,0,0,0,0,0,0,0,0,0,0,0,0,0,0,0,0,0,0,0,0,0,Camper Magazine Luca rovina la copertina della rivista preferita di Paolo.
968,3,142,Auricolare senza fili,Il nuovo auricolare di Gaia crea qualche malinteso in azienda.,,8 marzo 2006,['gaia'],0,0,0,0,0,0,0,0,0,0,0,0,0,0,0,0,0,1,0,0,0,0,0,0,0,Auricolare senza fili Il nuovo auricolare di Gaia crea qualche malinteso in azienda.
969,3,143,La setta segreta,Paolo crede che Giovanna faccia parte di una setta che adora una dea egizia e che uccide le persone che mentono.,,8 marzo 2006,"['paolo', 'anna', 'giovanna']",0,1,0,0,0,0,0,0,0,0,1,0,0,0,0,0,0,0,0,0,0,0,1,0,0,La setta segreta Paolo crede che Giovanna faccia parte di una setta che adora una dea egizia e che uccide le persone che mentono.
970,3,144,La festa di Alex,Patty e Pippo organizzano una festa per Alex ma tutti vogliono imbucarsi.,,8 marzo 2006,"['patty', 'alex', 'pippo']",0,0,1,0,0,0,0,1,0,0,0,0,0,0,0,0,1,0,0,0,0,0,0,0,0,La festa di Alex Patty e Pippo organizzano una festa per Alex ma tutti vogliono imbucarsi.
971,3,145,Anima gemella,Emma aiuta Patti a trovare un uomo.,,8 marzo 2006,"['patti', 'emma']",0,0,0,1,0,0,0,0,0,0,0,1,0,0,0,0,0,0,0,0,0,0,0,0,0,Anima gemella Emma aiuta Patti a trovare un uomo.
972,3,146,La bandana,In azienda i colleghi vogliono scoprire una volta per tutte perché Giovanna indossa sempre una bandana.,,8 marzo 2006,"['anna', 'giovanna']",0,0,0,0,0,0,0,0,0,0,1,0,0,0,0,0,0,0,0,0,0,0,1,0,0,La bandana In azienda i colleghi vogliono scoprire una volta per tutte perché Giovanna indossa sempre una bandana.
973,3,147,Camera antipanico,Olmo rimane chiuso in una camera antipanico.,['Dario Solini'],8 marzo 2006,['olmo'],0,0,0,0,0,1,0,0,0,0,0,0,0,0,0,0,0,0,0,0,0,0,0,0,0,Camera antipanico Olmo rimane chiuso in una camera antipanico.
974,3,148,12 anni,Luca cerca di rimettersi con Alex sfruttando l’occasione della festa dei 12 anni da direttore di De Marinis.,,8 marzo 2006,"['luca', 'alex', 'de marinis']",1,0,0,0,0,0,0,1,0,0,0,0,1,0,0,0,0,0,0,0,0,0,0,0,0,12 anni Luca cerca di rimettersi con Alex sfruttando l’occasione della festa dei 12 anni da direttore di De Marinis.
975,3,149,La petizione,Vasile tenta di convincere Luca e Paolo a firmare una petizione contro i ROM.,,8 marzo 2006,"['luca', 'paolo']",1,1,0,0,0,0,0,0,0,0,0,0,0,0,0,0,0,0,0,0,0,0,0,0,0,La petizione Vasile tenta di convincere Luca e Paolo a firmare una petizione contro i ROM.
976,3,150,La recita,Luca parla ad Alex della sua recita scolastica sull'arca di Noè.,,8 marzo 2006,"['luca', 'alex']",1,0,0,0,0,0,0,1,0,0,0,0,0,0,0,0,0,0,0,0,0,0,0,0,0,La recita Luca parla ad Alex della sua recita scolastica sull'arca di Noè.
977,3,151,Laurea,Paolo riceve a sorpresa una laurea.,,8 marzo 2006,['paolo'],0,1,0,0,0,0,0,0,0,0,0,0,0,0,0,0,0,0,0,0,0,0,0,0,0,Laurea Paolo riceve a sorpresa una laurea.
978,3,152,Casa in prestito,Alex presta la sua casa a Roberto e va a stare da Luca.,,8 marzo 2006,"['luca', 'alex']",1,0,0,0,0,0,0,1,0,0,0,0,0,0,0,0,0,0,0,0,0,0,0,0,0,Casa in prestito Alex presta la sua casa a Roberto e va a stare da Luca.
979,3,153,Il bacio,Luca e Paolo fanno una scommessa: riuscire a baciare Gaia.,,8 marzo 2006,"['luca', 'paolo', 'gaia']",1,1,0,0,0,0,0,0,0,0,0,0,0,0,0,0,0,1,0,0,0,0,0,0,0,Il bacio Luca e Paolo fanno una scommessa: riuscire a baciare Gaia.
980,3,154,Il tartufo,Paolo compra un tartufo da Budello.,,8 marzo 2006,['paolo'],0,1,0,0,0,0,0,0,0,0,0,0,0,0,0,0,0,0,0,0,0,0,0,0,0,Il tartufo Paolo compra un tartufo da Budello.
981,3,155,Pericolo tattoo,Paolo e Luca fanno un tatuaggio a Silvano.,,12 marzo 2006,"['luca', 'paolo', 'silvano']",1,1,0,0,1,0,0,0,0,0,0,0,0,0,0,0,0,0,0,0,0,0,0,0,0,Pericolo tattoo Paolo e Luca fanno un tatuaggio a Silvano.
982,3,156,Silvano aggiustatutto,"Silvano ""ripara"" la macchinetta del caffè.",,12 marzo 2006,['silvano'],0,0,0,0,1,0,0,0,0,0,0,0,0,0,0,0,0,0,0,0,0,0,0,0,0,"Silvano aggiustatutto Silvano ""ripara"" la macchinetta del caffè."
983,3,157,20 secondi,"Olmo tenta di vincere una scommessa: entrare in bagno e uscire dall'ascensore, il tutto in 20 secondi.",,12 marzo 2006,['olmo'],0,0,0,0,0,1,0,0,0,0,0,0,0,0,0,0,0,0,0,0,0,0,0,0,0,"20 secondi Olmo tenta di vincere una scommessa: entrare in bagno e uscire dall'ascensore, il tutto in 20 secondi."
984,3,158,Amanti impossibili,Andrea entra in crisi a causa dell'innamoramento di Pietà e Marylin.,,12 marzo 2006,['andrea'],0,0,0,0,0,0,0,0,0,0,0,0,0,1,0,0,0,0,0,0,0,0,0,0,0,Amanti impossibili Andrea entra in crisi a causa dell'innamoramento di Pietà e Marylin.
985,3,159,Educazione civica,Wanda è stata borseggiata. Luca e Paolo la aiutano a scoprire chi è stato.,,12 marzo 2006,"['luca', 'paolo', 'wanda']",1,1,0,0,0,0,0,0,0,0,0,0,0,0,0,0,0,0,0,0,0,1,0,0,0,Educazione civica Wanda è stata borseggiata. Luca e Paolo la aiutano a scoprire chi è stato.
986,3,160,Lettera anonima,"Vasile riceve una lettera anonima piena di insulti, e subito sospetta che i colpevoli siano Luca e Paolo.",['Dino Abbrescia'],12 marzo 2006,"['luca', 'paolo']",1,1,0,0,0,0,0,0,0,0,0,0,0,0,0,0,0,0,0,0,0,0,0,0,0,"Lettera anonima Vasile riceve una lettera anonima piena di insulti, e subito sospetta che i colpevoli siano Luca e Paolo."
987,3,161,Redenzione,"Il collega Carlo, che ha passato sei mesi in una clinica per disintossicarsi dall'alcol, torna in azienda.",['Antonio Conte'],12 marzo 2006,[],0,0,0,0,0,0,0,0,0,0,0,0,0,0,0,0,0,0,0,0,0,0,0,0,0,"Redenzione Il collega Carlo, che ha passato sei mesi in una clinica per disintossicarsi dall'alcol, torna in azienda."
988,3,162,Il bambino prodigio,Olmo scopre che da piccolo Vittorio era il protagonista di un famoso carosello.,,12 marzo 2006,"['olmo', 'vittorio']",0,0,0,0,0,1,0,0,0,0,0,0,0,0,0,1,0,0,0,0,0,0,0,0,0,Il bambino prodigio Olmo scopre che da piccolo Vittorio era il protagonista di un famoso carosello.
989,3,163,Il crocifisso,Luca vuole far rimuovere il crocifisso dall'area relax.,,12 marzo 2006,['luca'],1,0,0,0,0,0,0,0,0,0,0,0,0,0,0,0,0,0,0,0,0,0,0,0,0,Il crocifisso Luca vuole far rimuovere il crocifisso dall'area relax.
990,3,164,Regista per un giorno,Luca realizza un cortometraggio in azienda.,,12 marzo 2006,['luca'],1,0,0,0,0,0,0,0,0,0,0,0,0,0,0,0,0,0,0,0,0,0,0,0,0,Regista per un giorno Luca realizza un cortometraggio in azienda.
991,3,165,Sporcizia,Silvano è sbalordito dalla sporcizia di Paolo.,,12 marzo 2006,"['paolo', 'silvano']",0,1,0,0,1,0,0,0,0,0,0,0,0,0,0,0,0,0,0,0,0,0,0,0,0,Sporcizia Silvano è sbalordito dalla sporcizia di Paolo.
