,season,episodio,titolo,trama,guest_star,prima_visione,tags,luca,paolo,patty,patti,silvano,olmo,gloria,alex,caterina,lucrezia,anna,emma,de marinis,andrea,geller,vittorio,pippo,gaia,jessica,ilaria,valeria,wanda,giovanna,maria eleonara,carminati,title_trama
0,1,1,Passaportafogli,Paolo dimentica il suo portafogli su un taxi e il tassista lo riporta in azienda.,,6 ottobre 2003,['paolo'],0,1,0,0,0,0,0,0,0,0,0,0,0,0,0,0,0,0,0,0,0,0,0,0,0,Passaportafogli Paolo dimentica il suo portafogli su un taxi e il tassista lo riporta in azienda.
1,1,2,Posizione scomoda,Silvano rimane con la mano incastrata nella macchinetta del caffè.,,7 ottobre 2003,['silvano'],0,0,0,0,1,0,0,0,0,0,0,0,0,0,0,0,0,0,0,0,0,0,0,0,0,Posizione scomoda Silvano rimane con la mano incastrata nella macchinetta del caffè.
2,1,3,La sfida,Luca e Paolo si sfidano a braccio di ferro per stabilire chi dei due andrà in vacanza con Gaia.,,8 ottobre 2003,"['luca', 'paolo', 'gaia']",1,1,0,0,0,0,0,0,0,0,0,0,0,0,0,0,0,1,0,0,0,0,0,0,0,La sfida Luca e Paolo si sfidano a braccio di ferro per stabilire chi dei due andrà in vacanza con Gaia.
3,1,4,Incontro di boxe,"Paolo, iscrittosi a un torneo di boxe, deve sfidare Andrea.",,9 ottobre 2003,"['paolo', 'andrea']",0,1,0,0,0,0,0,0,0,0,0,0,0,1,0,0,0,0,0,0,0,0,0,0,0,"Incontro di boxe Paolo, iscrittosi a un torneo di boxe, deve sfidare Andrea."
4,1,5,Venduti,I dipendenti temono che l'azienda possa essere venduta.,,10 ottobre 2003,[],0,0,0,0,0,0,0,0,0,0,0,0,0,0,0,0,0,0,0,0,0,0,0,0,0,Venduti I dipendenti temono che l'azienda possa essere venduta.
5,1,6,Fatto di cronaca,La Digitex è vittima di un killer che si diverte ad avvelenare il caffè,,13 ottobre 2003,[],0,0,0,0,0,0,0,0,0,0,0,0,0,0,0,0,0,0,0,0,0,0,0,0,0,Fatto di cronaca La Digitex è vittima di un killer che si diverte ad avvelenare il caffè
6,1,7,Il grande ufficio,"Paolo ha un nuovo ufficio, molto più grande di quello di Luca.",,14 ottobre 2003,"['luca', 'paolo']",1,1,0,0,0,0,0,0,0,0,0,0,0,0,0,0,0,0,0,0,0,0,0,0,0,"Il grande ufficio Paolo ha un nuovo ufficio, molto più grande di quello di Luca."
7,1,8,Il portafogli,Luca e Paolo rubano il portafogli di De Marinis.,,15 ottobre 2003,"['luca', 'paolo', 'de marinis']",1,1,0,0,0,0,0,0,0,0,0,0,1,0,0,0,0,0,0,0,0,0,0,0,0,Il portafogli Luca e Paolo rubano il portafogli di De Marinis.
8,1,9,Patti si fa bella,Patti vorrebbe affidarsi alla chirurgia estetica.,,16 ottobre 2003,['patti'],0,0,0,1,0,0,0,0,0,0,0,0,0,0,0,0,0,0,0,0,0,0,0,0,0,Patti si fa bella Patti vorrebbe affidarsi alla chirurgia estetica.
9,1,10,Quiz Radiofonico,"Silvano è stato selezionato a un quiz radiofonico, grazie al quale potrebbe vincere 1 000 euro.",,16 ottobre 2003,['silvano'],0,0,0,0,1,0,0,0,0,0,0,0,0,0,0,0,0,0,0,0,0,0,0,0,0,"Quiz Radiofonico Silvano è stato selezionato a un quiz radiofonico, grazie al quale potrebbe vincere 1 000 euro."
10,1,11,Esame delle urine,Paolo si deve sottoporre all'esame delle urine.,,16 ottobre 2003,['paolo'],0,1,0,0,0,0,0,0,0,0,0,0,0,0,0,0,0,0,0,0,0,0,0,0,0,Esame delle urine Paolo si deve sottoporre all'esame delle urine.
11,1,12,Il camionista,Paolo ha una brutta discussione con un camionista.,,17 ottobre 2003,['paolo'],0,1,0,0,0,0,0,0,0,0,0,0,0,0,0,0,0,0,0,0,0,0,0,0,0,Il camionista Paolo ha una brutta discussione con un camionista.
12,1,13,Licenziarsi,Luca e Paolo vorrebbero dare le dimissioni.,,17 ottobre 2003,"['luca', 'paolo']",1,1,0,0,0,0,0,0,0,0,0,0,0,0,0,0,0,0,0,0,0,0,0,0,0,Licenziarsi Luca e Paolo vorrebbero dare le dimissioni.
13,1,14,Paranoia,In azienda gira la voce che qualcuno stia per essere licenziato.,,17 ottobre 2003,[],0,0,0,0,0,0,0,0,0,0,0,0,0,0,0,0,0,0,0,0,0,0,0,0,0,Paranoia In azienda gira la voce che qualcuno stia per essere licenziato.
14,1,15,Pidocchi,Patti ha i pidocchi.,,17 ottobre 2003,['patti'],0,0,0,1,0,0,0,0,0,0,0,0,0,0,0,0,0,0,0,0,0,0,0,0,0,Pidocchi Patti ha i pidocchi.
15,1,16,Cosa fai stasera?,"Luca, Paolo e Silvano discutono dei loro impegni serali.",,18 ottobre 2003,"['luca', 'paolo', 'silvano']",1,1,0,0,1,0,0,0,0,0,0,0,0,0,0,0,0,0,0,0,0,0,0,0,0,"Cosa fai stasera? Luca, Paolo e Silvano discutono dei loro impegni serali."
16,1,17,Il portiere,Silvano fa il portiere.,,18 ottobre 2003,['silvano'],0,0,0,0,1,0,0,0,0,0,0,0,0,0,0,0,0,0,0,0,0,0,0,0,0,Il portiere Silvano fa il portiere.
17,1,18,L'incidente,"Luca tampona una macchina con l'Alfa Romeo di Paolo, non sapendo che è quella di Ilaria.",,18 ottobre 2003,"['luca', 'paolo', 'ilaria']",1,1,0,0,0,0,0,0,0,0,0,0,0,0,0,0,0,0,0,1,0,0,0,0,0,"L'incidente Luca tampona una macchina con l'Alfa Romeo di Paolo, non sapendo che è quella di Ilaria."
18,1,19,Nuovo look,Patti vuole cambiare look.,,18 ottobre 2003,['patti'],0,0,0,1,0,0,0,0,0,0,0,0,0,0,0,0,0,0,0,0,0,0,0,0,0,Nuovo look Patti vuole cambiare look.
19,1,20,Pensione d'invalidità,Luca si fa male e Paolo lo convince a gonfiare leggermente il suo problema per prendere la pensione d'invalidità.,,20 ottobre 2003,"['luca', 'paolo']",1,1,0,0,0,0,0,0,0,0,0,0,0,0,0,0,0,0,0,0,0,0,0,0,0,Pensione d'invalidità Luca si fa male e Paolo lo convince a gonfiare leggermente il suo problema per prendere la pensione d'invalidità.
20,1,21,Gesto fatale,Luca cerca di interpretare i gesti dei colleghi.,,20 ottobre 2003,['luca'],1,0,0,0,0,0,0,0,0,0,0,0,0,0,0,0,0,0,0,0,0,0,0,0,0,Gesto fatale Luca cerca di interpretare i gesti dei colleghi.
21,1,22,Il peso,"Anna, Alex e Patti parlano del loro peso.",,20 ottobre 2003,"['patti', 'alex', 'anna']",0,0,0,1,0,0,0,1,0,0,1,0,0,0,0,0,0,0,0,0,0,0,0,0,0,"Il peso Anna, Alex e Patti parlano del loro peso."
22,1,23,Pronto soccorso,"Silvano si sente male e Luca, che ha appena promesso a Gaia che i loro rapporti si sarebbero riallacciati, cerca di salvarlo.",,20 ottobre 2003,"['luca', 'silvano', 'gaia']",1,0,0,0,1,0,0,0,0,0,0,0,0,0,0,0,0,1,0,0,0,0,0,0,0,"Pronto soccorso Silvano si sente male e Luca, che ha appena promesso a Gaia che i loro rapporti si sarebbero riallacciati, cerca di salvarlo."
23,1,24,Reinserimento,"In azienda è arrivato un ex-carcerato. Luca e Paolo ci sono molto affezionati, fino a quando Anna non si accorge che le è stato rubato il portafogli.",['Davide Giandrini'],20 ottobre 2003,"['luca', 'paolo', 'anna']",1,1,0,0,0,0,0,0,0,0,1,0,0,0,0,0,0,0,0,0,0,0,0,0,0,"Reinserimento In azienda è arrivato un ex-carcerato. Luca e Paolo ci sono molto affezionati, fino a quando Anna non si accorge che le è stato rubato il portafogli."
24,1,25,Pedalare,Paolo sfida il venditore della Digitex a una gara di ciclismo.,,20 ottobre 2003,['paolo'],0,1,0,0,0,0,0,0,0,0,0,0,0,0,0,0,0,0,0,0,0,0,0,0,0,Pedalare Paolo sfida il venditore della Digitex a una gara di ciclismo.
25,1,26,Allarme antincendio,"Luca, Paolo e Ilaria rimangono bloccati in azienda durante un incendio, ma Luca crede sia un'esercitazione.",,20 ottobre 2003,"['luca', 'paolo', 'ilaria']",1,1,0,0,0,0,0,0,0,0,0,0,0,0,0,0,0,0,0,1,0,0,0,0,0,"Allarme antincendio Luca, Paolo e Ilaria rimangono bloccati in azienda durante un incendio, ma Luca crede sia un'esercitazione."
26,1,27,Urna,Silvano porta in ufficio un'urna funeraria.,,20 ottobre 2003,['silvano'],0,0,0,0,1,0,0,0,0,0,0,0,0,0,0,0,0,0,0,0,0,0,0,0,0,Urna Silvano porta in ufficio un'urna funeraria.
27,1,28,Poesia,Paolo è costretto ad assistere allo spettacolo teatrale di Patti.,,23 ottobre 2003,"['paolo', 'patti']",0,1,0,1,0,0,0,0,0,0,0,0,0,0,0,0,0,0,0,0,0,0,0,0,0,Poesia Paolo è costretto ad assistere allo spettacolo teatrale di Patti.
28,1,29,Mazzetti di mughetto,Luca e Paolo combattono per il monopolio sul mughetto.,,23 ottobre 2003,"['luca', 'paolo']",1,1,0,0,0,0,0,0,0,0,0,0,0,0,0,0,0,0,0,0,0,0,0,0,0,Mazzetti di mughetto Luca e Paolo combattono per il monopolio sul mughetto.
29,1,30,Psicofarmaci,Anna assume troppi psicofarmaci e Patti si preoccupa per lei.,,23 ottobre 2003,"['patti', 'anna']",0,0,0,1,0,0,0,0,0,0,1,0,0,0,0,0,0,0,0,0,0,0,0,0,0,Psicofarmaci Anna assume troppi psicofarmaci e Patti si preoccupa per lei.
30,1,31,Bella,Luca fa amicizia con una donna delle pulizie.,['Isa Gallinelli'],23 ottobre 2003,['luca'],1,0,0,0,0,0,0,0,0,0,0,0,0,0,0,0,0,0,0,0,0,0,0,0,0,Bella Luca fa amicizia con una donna delle pulizie.
31,1,32,Il criceto,Giovanna affida a Luca un criceto da accudire.,,23 ottobre 2003,"['luca', 'anna', 'giovanna']",1,0,0,0,0,0,0,0,0,0,1,0,0,0,0,0,0,0,0,0,0,0,1,0,0,Il criceto Giovanna affida a Luca un criceto da accudire.
32,1,33,A.A.A. cercasi,Paolo crede che Anna abbia messo un annuncio erotico sul giornale.,,23 ottobre 2003,"['paolo', 'anna']",0,1,0,0,0,0,0,0,0,0,1,0,0,0,0,0,0,0,0,0,0,0,0,0,0,A.A.A. cercasi Paolo crede che Anna abbia messo un annuncio erotico sul giornale.
33,1,34,Il sogno di Olmo,Olmo riesce a creare un programma per controllare tutti gli apparecchi informatici dell'azienda.,,23 ottobre 2003,['olmo'],0,0,0,0,0,1,0,0,0,0,0,0,0,0,0,0,0,0,0,0,0,0,0,0,0,Il sogno di Olmo Olmo riesce a creare un programma per controllare tutti gli apparecchi informatici dell'azienda.
34,1,35,Bustarelle,De Marinis offre una bustarella a una commissione di sicurezza.,['Michele Bottini'],23 ottobre 2003,['de marinis'],0,0,0,0,0,0,0,0,0,0,0,0,1,0,0,0,0,0,0,0,0,0,0,0,0,Bustarelle De Marinis offre una bustarella a una commissione di sicurezza.
35,1,36,In panne,L'ascensore del palazzo è rotto.,,26 ottobre 2003,[],0,0,0,0,0,0,0,0,0,0,0,0,0,0,0,0,0,0,0,0,0,0,0,0,0,In panne L'ascensore del palazzo è rotto.
36,1,37,Pizza,"In azienda viene consegnata una pizza: Paolo, Luca e Silvano, credendo sia per il direttore, la farciscono in maniera disgustosa.",,27 ottobre 2003,"['luca', 'paolo', 'silvano']",1,1,0,0,1,0,0,0,0,0,0,0,0,0,0,0,0,0,0,0,0,0,0,0,0,"Pizza In azienda viene consegnata una pizza: Paolo, Luca e Silvano, credendo sia per il direttore, la farciscono in maniera disgustosa."
37,1,38,Uccellini,Luca e Paolo scattano delle foto in pose assurde con quella che credono sia la macchina fotografica di Patti,,27 ottobre 2003,"['luca', 'paolo', 'patti']",1,1,0,1,0,0,0,0,0,0,0,0,0,0,0,0,0,0,0,0,0,0,0,0,0,Uccellini Luca e Paolo scattano delle foto in pose assurde con quella che credono sia la macchina fotografica di Patti
38,1,39,Allarme antrace,In azienda viene recapitata una busta contenente una misteriosa polverina bianca. Tutti pensano che sia antrace e scatta immediatamente il panico.,,27 ottobre 2003,[],0,0,0,0,0,0,0,0,0,0,0,0,0,0,0,0,0,0,0,0,0,0,0,0,0,Allarme antrace In azienda viene recapitata una busta contenente una misteriosa polverina bianca. Tutti pensano che sia antrace e scatta immediatamente il panico.
39,1,40,Un regalo personale,Paolo è l'unico a non partecipare alla colletta per il regalo a De Marinis.,,27 ottobre 2003,"['paolo', 'de marinis']",0,1,0,0,0,0,0,0,0,0,0,0,1,0,0,0,0,0,0,0,0,0,0,0,0,Un regalo personale Paolo è l'unico a non partecipare alla colletta per il regalo a De Marinis.
40,1,41,Buone azioni,Patti eredita dei soldi da uno degli anziani della casa di riposo di cui si prende cura. Paolo si mette in testa di fare la stessa cosa.,,27 ottobre 2003,"['paolo', 'patti']",0,1,0,1,0,0,0,0,0,0,0,0,0,0,0,0,0,0,0,0,0,0,0,0,0,Buone azioni Patti eredita dei soldi da uno degli anziani della casa di riposo di cui si prende cura. Paolo si mette in testa di fare la stessa cosa.
41,1,42,Notte tragica,Paolo e Luca incontrano Vittorio per la prima volta.,,27 ottobre 2003,"['luca', 'paolo', 'vittorio']",1,1,0,0,0,0,0,0,0,0,0,0,0,0,0,1,0,0,0,0,0,0,0,0,0,Notte tragica Paolo e Luca incontrano Vittorio per la prima volta.
42,1,43,Il compleanno di Silvano,Silvano organizza una festa di compleanno.,,27 ottobre 2003,['silvano'],0,0,0,0,1,0,0,0,0,0,0,0,0,0,0,0,0,0,0,0,0,0,0,0,0,Il compleanno di Silvano Silvano organizza una festa di compleanno.
43,1,44,Timer,Jessica fa installare nella macchinetta e alla porta del bagno dei timer che impediscono ai dipendenti di perdere tempo.,,27 ottobre 2003,['jessica'],0,0,0,0,0,0,0,0,0,0,0,0,0,0,0,0,0,0,1,0,0,0,0,0,0,Timer Jessica fa installare nella macchinetta e alla porta del bagno dei timer che impediscono ai dipendenti di perdere tempo.
44,1,45,Fiera,Luca non è nel gruppo dei dipendenti scelti per l'attesissima trasferta di Parigi.,,27 ottobre 2003,['luca'],1,0,0,0,0,0,0,0,0,0,0,0,0,0,0,0,0,0,0,0,0,0,0,0,0,Fiera Luca non è nel gruppo dei dipendenti scelti per l'attesissima trasferta di Parigi.
45,1,46,Annuncio di smarrimento,"Gaia è triste perché ha smarrito Willy, il suo cagnolino. Paolo tenta di ritrovarlo.",,27 ottobre 2003,"['paolo', 'gaia']",0,1,0,0,0,0,0,0,0,0,0,0,0,0,0,0,0,1,0,0,0,0,0,0,0,"Annuncio di smarrimento Gaia è triste perché ha smarrito Willy, il suo cagnolino. Paolo tenta di ritrovarlo."
46,1,47,Il fantasma,L'aereo su cui viaggiava De Marinis è precipitato.,,28 ottobre 2003,['de marinis'],0,0,0,0,0,0,0,0,0,0,0,0,1,0,0,0,0,0,0,0,0,0,0,0,0,Il fantasma L'aereo su cui viaggiava De Marinis è precipitato.
47,1,48,Cartomanzia,Anna fa delle divinazioni per Luca e Paolo.,,28 ottobre 2003,"['luca', 'paolo', 'anna']",1,1,0,0,0,0,0,0,0,0,1,0,0,0,0,0,0,0,0,0,0,0,0,0,0,Cartomanzia Anna fa delle divinazioni per Luca e Paolo.
48,1,49,La piscina,Paolo cerca di vendere un suo terreno a Silvano.,,28 ottobre 2003,"['paolo', 'silvano']",0,1,0,0,1,0,0,0,0,0,0,0,0,0,0,0,0,0,0,0,0,0,0,0,0,La piscina Paolo cerca di vendere un suo terreno a Silvano.
49,1,50,Concorso di colpa,Andrea vuole dare la colpa ai suoi colleghi per un guaio che ha combinato.,,28 ottobre 2003,['andrea'],0,0,0,0,0,0,0,0,0,0,0,0,0,1,0,0,0,0,0,0,0,0,0,0,0,Concorso di colpa Andrea vuole dare la colpa ai suoi colleghi per un guaio che ha combinato.
50,1,51,Errore contabile,"A causa di una ricevuta da 1000000 €, Paolo si crede ricco.",,28 ottobre 2003,['paolo'],0,1,0,0,0,0,0,0,0,0,0,0,0,0,0,0,0,0,0,0,0,0,0,0,0,"Errore contabile A causa di una ricevuta da 1000000 €, Paolo si crede ricco."
51,1,52,Mal di denti,Patti ha un forte mal di denti.,,28 ottobre 2003,['patti'],0,0,0,1,0,0,0,0,0,0,0,0,0,0,0,0,0,0,0,0,0,0,0,0,0,Mal di denti Patti ha un forte mal di denti.
52,1,53,Giorno di sciopero,I dipendenti non riescono a mettersi d'accordo su quale giorno fare sciopero.,,28 ottobre 2003,[],0,0,0,0,0,0,0,0,0,0,0,0,0,0,0,0,0,0,0,0,0,0,0,0,0,Giorno di sciopero I dipendenti non riescono a mettersi d'accordo su quale giorno fare sciopero.
53,1,54,Tutti uniti,La Digitex è stata occupata dai suoi dipendenti: Luca e Paolo decidono di aiutare la polizia a stanarli.,['Hubert Stergacic'],28 ottobre 2003,"['luca', 'paolo']",1,1,0,0,0,0,0,0,0,0,0,0,0,0,0,0,0,0,0,0,0,0,0,0,0,Tutti uniti La Digitex è stata occupata dai suoi dipendenti: Luca e Paolo decidono di aiutare la polizia a stanarli.
54,1,55,Il cinefilo,Luca realizza un filmino erotico con una sua amante.,['Claudia Griffini'],28 ottobre 2003,['luca'],1,0,0,0,0,0,0,0,0,0,0,0,0,0,0,0,0,0,0,0,0,0,0,0,0,Il cinefilo Luca realizza un filmino erotico con una sua amante.
55,1,56,Torcicollo,Paolo ha il torcicollo.,,28 ottobre 2003,['paolo'],0,1,0,0,0,0,0,0,0,0,0,0,0,0,0,0,0,0,0,0,0,0,0,0,0,Torcicollo Paolo ha il torcicollo.
56,1,57,Caffè transgenico,Luca ha dei dubbi sulla qualità del cibo servito nella mensa aziendale.,,28 ottobre 2003,['luca'],1,0,0,0,0,0,0,0,0,0,0,0,0,0,0,0,0,0,0,0,0,0,0,0,0,Caffè transgenico Luca ha dei dubbi sulla qualità del cibo servito nella mensa aziendale.
57,1,58,Lo stand,Paolo non vuole andare in trasferta a una fiera per conto dell'azienda.,,29 ottobre 2003,['paolo'],0,1,0,0,0,0,0,0,0,0,0,0,0,0,0,0,0,0,0,0,0,0,0,0,0,Lo stand Paolo non vuole andare in trasferta a una fiera per conto dell'azienda.
58,1,59,Il venditore,Luca e Paolo trattano con un venditore di fotocopiatrici.,['Massimo Sabet'],29 ottobre 2003,"['luca', 'paolo']",1,1,0,0,0,0,0,0,0,0,0,0,0,0,0,0,0,0,0,0,0,0,0,0,0,Il venditore Luca e Paolo trattano con un venditore di fotocopiatrici.
59,1,60,La cerniera,Paolo ha un problema con la cerniera dei pantaloni.,,29 ottobre 2003,['paolo'],0,1,0,0,0,0,0,0,0,0,0,0,0,0,0,0,0,0,0,0,0,0,0,0,0,La cerniera Paolo ha un problema con la cerniera dei pantaloni.
60,1,61,Vuoto di memoria,"Durante una festa, Alex abborda Vittorio, ma tornata in ufficio non ricorda l'esito della serata.",,29 ottobre 2003,"['alex', 'vittorio']",0,0,0,0,0,0,0,1,0,0,0,0,0,0,0,1,0,0,0,0,0,0,0,0,0,"Vuoto di memoria Durante una festa, Alex abborda Vittorio, ma tornata in ufficio non ricorda l'esito della serata."
61,1,62,Il complotto,Tutti i dipendenti dell'azienda complottano contro Luca.,,29 ottobre 2003,['luca'],1,0,0,0,0,0,0,0,0,0,0,0,0,0,0,0,0,0,0,0,0,0,0,0,0,Il complotto Tutti i dipendenti dell'azienda complottano contro Luca.
62,1,63,Omonimia,Gaia simpatizza con un nuovo Paolo Bitta.,['Filippo Usellini'],29 ottobre 2003,"['paolo', 'gaia']",0,1,0,0,0,0,0,0,0,0,0,0,0,0,0,0,0,1,0,0,0,0,0,0,0,Omonimia Gaia simpatizza con un nuovo Paolo Bitta.
63,1,64,Mercato internazionale,"Paolo ha finalmente la sua grande occasione: De Marinis, infatti, gli ha affidato il mercato estero.",,29 ottobre 2003,"['paolo', 'de marinis']",0,1,0,0,0,0,0,0,0,0,0,0,1,0,0,0,0,0,0,0,0,0,0,0,0,"Mercato internazionale Paolo ha finalmente la sua grande occasione: De Marinis, infatti, gli ha affidato il mercato estero."
64,1,65,Corna,L'assistente di Paolo si vuole licenziare.,['Alessandro Scavone'],29 ottobre 2003,['paolo'],0,1,0,0,0,0,0,0,0,0,0,0,0,0,0,0,0,0,0,0,0,0,0,0,0,Corna L'assistente di Paolo si vuole licenziare.
65,1,66,Il trasloco,De Marinis vuole trasferire gli uffici dell'azienda in un nuovo palazzo.,,29 ottobre 2003,['de marinis'],0,0,0,0,0,0,0,0,0,0,0,0,1,0,0,0,0,0,0,0,0,0,0,0,0,Il trasloco De Marinis vuole trasferire gli uffici dell'azienda in un nuovo palazzo.
66,1,67,Luca testimone,Paolo convince Luca a testimoniare a suo favore in un incidente automobilistico.,['Luciana Littizzetto'],29 ottobre 2003,"['luca', 'paolo']",1,1,0,0,0,0,0,0,0,0,0,0,0,0,0,0,0,0,0,0,0,0,0,0,0,Luca testimone Paolo convince Luca a testimoniare a suo favore in un incidente automobilistico.
67,1,68,Selvaggina per cena,Paolo vuole andare a caccia con Silvano.,,29 ottobre 2003,"['paolo', 'silvano']",0,1,0,0,1,0,0,0,0,0,0,0,0,0,0,0,0,0,0,0,0,0,0,0,0,Selvaggina per cena Paolo vuole andare a caccia con Silvano.
68,1,69,Stato di shock,Paolo ha investito con la sua Alfa la zia di De Marinis e per questo teme di essere licenziato.,,29 ottobre 2003,"['paolo', 'de marinis']",0,1,0,0,0,0,0,0,0,0,0,0,1,0,0,0,0,0,0,0,0,0,0,0,0,Stato di shock Paolo ha investito con la sua Alfa la zia di De Marinis e per questo teme di essere licenziato.
69,1,70,Domenica lavorativa,I dipendenti dell'azienda si lamentano per essere costretti a lavorare anche di domenica.,,29 ottobre 2003,[],0,0,0,0,0,0,0,0,0,0,0,0,0,0,0,0,0,0,0,0,0,0,0,0,0,Domenica lavorativa I dipendenti dell'azienda si lamentano per essere costretti a lavorare anche di domenica.
70,1,71,Allunga la vita,"Luca, Paolo e Silvano leggono sul giornale che, secondo un recente studio, guardare un bel seno allunga la vita.",,31 ottobre 2003,"['luca', 'paolo', 'silvano']",1,1,0,0,1,0,0,0,0,0,0,0,0,0,0,0,0,0,0,0,0,0,0,0,0,"Allunga la vita Luca, Paolo e Silvano leggono sul giornale che, secondo un recente studio, guardare un bel seno allunga la vita."
71,1,72,Lotta politica,Luca e De Marinis fanno valere le proprie opinioni politiche.,,31 ottobre 2003,"['luca', 'de marinis']",1,0,0,0,0,0,0,0,0,0,0,0,1,0,0,0,0,0,0,0,0,0,0,0,0,Lotta politica Luca e De Marinis fanno valere le proprie opinioni politiche.
72,1,73,Il genio del calcolo,Luca scopre che Silvano è un genio nel calcolo mentale.,,31 ottobre 2003,"['luca', 'silvano']",1,0,0,0,1,0,0,0,0,0,0,0,0,0,0,0,0,0,0,0,0,0,0,0,0,Il genio del calcolo Luca scopre che Silvano è un genio nel calcolo mentale.
73,1,74,Armonia,Valeria si vuole separare da Paolo.,,31 ottobre 2003,"['paolo', 'valeria']",0,1,0,0,0,0,0,0,0,0,0,0,0,0,0,0,0,0,0,0,1,0,0,0,0,Armonia Valeria si vuole separare da Paolo.
74,1,75,L'ospite,Jessica arriva in azienda.,,31 ottobre 2003,['jessica'],0,0,0,0,0,0,0,0,0,0,0,0,0,0,0,0,0,0,1,0,0,0,0,0,0,L'ospite Jessica arriva in azienda.
75,1,76,La puzzola,"Titti, la sorella di Patti, emana un forte odore.",['Claudia Gerini'],31 ottobre 2003,['patti'],0,0,0,1,0,0,0,0,0,0,0,0,0,0,0,0,0,0,0,0,0,0,0,0,0,"La puzzola Titti, la sorella di Patti, emana un forte odore."
76,1,77,Best seller,"Pippo e Luca discutono a proposito del best seller del momento, uno scabroso romanzo erotico.",,31 ottobre 2003,"['luca', 'pippo']",1,0,0,0,0,0,0,0,0,0,0,0,0,0,0,0,1,0,0,0,0,0,0,0,0,"Best seller Pippo e Luca discutono a proposito del best seller del momento, uno scabroso romanzo erotico."
77,1,78,Proposta indecente,De Marinis perde la testa per Titti.,['Claudia Gerini'],31 ottobre 2003,['de marinis'],0,0,0,0,0,0,0,0,0,0,0,0,1,0,0,0,0,0,0,0,0,0,0,0,0,Proposta indecente De Marinis perde la testa per Titti.
78,1,79,Il gioco della moneta,Luca e Paolo cercano di fare canestro tirando una moneta in un bicchierino.,,31 ottobre 2003,"['luca', 'paolo']",1,1,0,0,0,0,0,0,0,0,0,0,0,0,0,0,0,0,0,0,0,0,0,0,0,Il gioco della moneta Luca e Paolo cercano di fare canestro tirando una moneta in un bicchierino.
79,1,80,Le foto della festa,Paolo si convince di essere stato a letto con Patti.,,31 ottobre 2003,"['paolo', 'patti']",0,1,0,1,0,0,0,0,0,0,0,0,0,0,0,0,0,0,0,0,0,0,0,0,0,Le foto della festa Paolo si convince di essere stato a letto con Patti.
80,1,81,I problemi del direttore,De Marinis sembra insoddisfatto del suo lavoro.,,31 ottobre 2003,['de marinis'],0,0,0,0,0,0,0,0,0,0,0,0,1,0,0,0,0,0,0,0,0,0,0,0,0,I problemi del direttore De Marinis sembra insoddisfatto del suo lavoro.
81,1,82,Il vendicatore mascherato,Silvano vuole affiancare Luca nella lotta sindacale.,,31 ottobre 2003,"['luca', 'silvano']",1,0,0,0,1,0,0,0,0,0,0,0,0,0,0,0,0,0,0,0,0,0,0,0,0,Il vendicatore mascherato Silvano vuole affiancare Luca nella lotta sindacale.
82,1,83,Pit bull,Pietà deve essere soppresso per aver aggredito una donna anziana.,,31 ottobre 2003,[],0,0,0,0,0,0,0,0,0,0,0,0,0,0,0,0,0,0,0,0,0,0,0,0,0,Pit bull Pietà deve essere soppresso per aver aggredito una donna anziana.
83,1,84,Cacciatore di teste,Paolo viene avvicinato da una persona che sembra interessata a offrirgli un nuovo lavoro.,['Alberto Angrisano'],31 ottobre 2003,['paolo'],0,1,0,0,0,0,0,0,0,0,0,0,0,0,0,0,0,0,0,0,0,0,0,0,0,Cacciatore di teste Paolo viene avvicinato da una persona che sembra interessata a offrirgli un nuovo lavoro.
84,1,85,Epidemia,"In azienda bisogna fare l'inventario, ma tutti i dipendenti sono malati.",,31 ottobre 2003,[],0,0,0,0,0,0,0,0,0,0,0,0,0,0,0,0,0,0,0,0,0,0,0,0,0,"Epidemia In azienda bisogna fare l'inventario, ma tutti i dipendenti sono malati."
85,1,86,Sciopero della fame,"Luca fa lo sciopero della fame per protestare contro la rimozione dei buoni pasto. Le cose vanno bene finché Paolo e Silvano, per sostenerlo, si abbuffano di cibo davanti a lui.",,31 ottobre 2003,"['luca', 'paolo', 'silvano']",1,1,0,0,1,0,0,0,0,0,0,0,0,0,0,0,0,0,0,0,0,0,0,0,0,"Sciopero della fame Luca fa lo sciopero della fame per protestare contro la rimozione dei buoni pasto. Le cose vanno bene finché Paolo e Silvano, per sostenerlo, si abbuffano di cibo davanti a lui."
86,1,87,Nemici amici,De Marinis è depresso e Luca è costretto a consolarlo.,,31 ottobre 2003,"['luca', 'de marinis']",1,0,0,0,0,0,0,0,0,0,0,0,1,0,0,0,0,0,0,0,0,0,0,0,0,Nemici amici De Marinis è depresso e Luca è costretto a consolarlo.
87,1,88,Pesce d'aprile,Luca fa un pesce d'aprile a Maggio.,,31 ottobre 2003,['luca'],1,0,0,0,0,0,0,0,0,0,0,0,0,0,0,0,0,0,0,0,0,0,0,0,0,Pesce d'aprile Luca fa un pesce d'aprile a Maggio.
88,1,89,Il ritorno,Luca e Paolo incontrano un vecchio collega.,['Alessandro Haber'],31 ottobre 2003,"['luca', 'paolo']",1,1,0,0,0,0,0,0,0,0,0,0,0,0,0,0,0,0,0,0,0,0,0,0,0,Il ritorno Luca e Paolo incontrano un vecchio collega.
89,1,90,Debito di gioco,Olmo ha un debito di gioco.,['Marco Fubini'],31 ottobre 2003,['olmo'],0,0,0,0,0,1,0,0,0,0,0,0,0,0,0,0,0,0,0,0,0,0,0,0,0,Debito di gioco Olmo ha un debito di gioco.
90,1,91,Violetta,"Violetta, un'amante di Paolo, va a trovarlo in azienda.",['Yvette Jordan'],31 ottobre 2003,['paolo'],0,1,0,0,0,0,0,0,0,0,0,0,0,0,0,0,0,0,0,0,0,0,0,0,0,"Violetta Violetta, un'amante di Paolo, va a trovarlo in azienda."
91,1,92,Sauna,Il bagno aziendale è stato trasformato in una sauna.,,31 ottobre 2003,[],0,0,0,0,0,0,0,0,0,0,0,0,0,0,0,0,0,0,0,0,0,0,0,0,0,Sauna Il bagno aziendale è stato trasformato in una sauna.
92,1,93,Schiavo degli ormoni,Paolo prende delle pastiglie per abbassare la virilità.,['Aída Yéspica'],31 ottobre 2003,['paolo'],0,1,0,0,0,0,0,0,0,0,0,0,0,0,0,0,0,0,0,0,0,0,0,0,0,Schiavo degli ormoni Paolo prende delle pastiglie per abbassare la virilità.
93,1,94,Il quadratone,Olmo sfida i colleghi a un gioco: il quadratone.,,31 ottobre 2003,['olmo'],0,0,0,0,0,1,0,0,0,0,0,0,0,0,0,0,0,0,0,0,0,0,0,0,0,Il quadratone Olmo sfida i colleghi a un gioco: il quadratone.
94,1,95,L'alpinista,"Gaia si è fidanzata con un alpinista, ma Luca è geloso di lui.",['Filippo Chiero'],31 ottobre 2003,"['luca', 'gaia']",1,0,0,0,0,0,0,0,0,0,0,0,0,0,0,0,0,1,0,0,0,0,0,0,0,"L'alpinista Gaia si è fidanzata con un alpinista, ma Luca è geloso di lui."
95,1,96,Segreteria telefonica,Gaia critica le segreterie telefoniche degli altri dipendenti.,,31 ottobre 2003,['gaia'],0,0,0,0,0,0,0,0,0,0,0,0,0,0,0,0,0,1,0,0,0,0,0,0,0,Segreteria telefonica Gaia critica le segreterie telefoniche degli altri dipendenti.
96,1,97,La liposuzione,Anna vuole sottoporsi alla liposuzione.,,31 ottobre 2003,['anna'],0,0,0,0,0,0,0,0,0,0,1,0,0,0,0,0,0,0,0,0,0,0,0,0,0,La liposuzione Anna vuole sottoporsi alla liposuzione.
97,1,98,La matrice,Luca e Paolo fanno credere a Silvano di essere il protagonista di Matrix.,,31 ottobre 2003,"['luca', 'paolo', 'silvano']",1,1,0,0,1,0,0,0,0,0,0,0,0,0,0,0,0,0,0,0,0,0,0,0,0,La matrice Luca e Paolo fanno credere a Silvano di essere il protagonista di Matrix.
98,1,99,Cinema amatoriale,Olmo gira un video amatoriale in azienda.,,31 ottobre 2003,['olmo'],0,0,0,0,0,1,0,0,0,0,0,0,0,0,0,0,0,0,0,0,0,0,0,0,0,Cinema amatoriale Olmo gira un video amatoriale in azienda.
