,season,episodio,titolo,trama,guest_star,prima_visione,tags,luca,paolo,patty,patti,silvano,olmo,gloria,alex,caterina,lucrezia,anna,emma,de marinis,andrea,geller,vittorio,pippo,gaia,jessica,ilaria,valeria,wanda,giovanna,maria eleonara,carminati,title_trama
473,1,476,La scusa,Paolo deve trovare una scusa per andare al salone del camperista.,,18 aprile 2004,['paolo'],0,1,0,0,0,0,0,0,0,0,0,0,0,0,0,0,0,0,0,0,0,0,0,0,0,La scusa Paolo deve trovare una scusa per andare al salone del camperista.
474,1,477,Riduzione di budget,La dirigenza ha in programma alcuni tagli.,,18 aprile 2004,[],0,0,0,0,0,0,0,0,0,0,0,0,0,0,0,0,0,0,0,0,0,0,0,0,0,Riduzione di budget La dirigenza ha in programma alcuni tagli.
475,1,478,Rivoluzione sessuale,In azienda è stata installata una macchina distributrice di preservativi.,,18 aprile 2004,[],0,0,0,0,0,0,0,0,0,0,0,0,0,0,0,0,0,0,0,0,0,0,0,0,0,Rivoluzione sessuale In azienda è stata installata una macchina distributrice di preservativi.
476,1,479,Depressione contagiosa,"In azienda arriva un uomo depresso, Ivo.",['Alberto Bognanni'],18 aprile 2004,[],0,0,0,0,0,0,0,0,0,0,0,0,0,0,0,0,0,0,0,0,0,0,0,0,0,"Depressione contagiosa In azienda arriva un uomo depresso, Ivo."
477,2,1,L'orecchino,Jessica perde un orecchino sotto la macchina del caffè.,,,['jessica'],0,0,0,0,0,0,0,0,0,0,0,0,0,0,0,0,0,0,1,0,0,0,0,0,0,L'orecchino Jessica perde un orecchino sotto la macchina del caffè.
478,2,2,Le cialde,"La macchinetta del caffè ha dei problemi, ma invece del solito Enrico si presenta un nuovo tecnico.",['Massimo Boldi'],,[],0,0,0,0,0,0,0,0,0,0,0,0,0,0,0,0,0,0,0,0,0,0,0,0,0,"Le cialde La macchinetta del caffè ha dei problemi, ma invece del solito Enrico si presenta un nuovo tecnico."
479,2,3,In prima pagina,Paolo finisce in prima pagina per essere stato fotografato davanti a un UFO.,,,['paolo'],0,1,0,0,0,0,0,0,0,0,0,0,0,0,0,0,0,0,0,0,0,0,0,0,0,In prima pagina Paolo finisce in prima pagina per essere stato fotografato davanti a un UFO.
480,2,4,La guerra dei calendari,Luca e De Marinis realizzano due diversi calendari aziendali.,['Andrea Baiardi'],,"['luca', 'de marinis']",1,0,0,0,0,0,0,0,0,0,0,0,1,0,0,0,0,0,0,0,0,0,0,0,0,La guerra dei calendari Luca e De Marinis realizzano due diversi calendari aziendali.
481,2,5,L'albero,Luca e Paolo gareggiano per chi riuscirà a conquistare Jessica con un albero di Natale.,,,"['luca', 'paolo', 'jessica']",1,1,0,0,0,0,0,0,0,0,0,0,0,0,0,0,0,0,1,0,0,0,0,0,0,L'albero Luca e Paolo gareggiano per chi riuscirà a conquistare Jessica con un albero di Natale.
482,2,6,Regalo per Patti,Patti chiede a Babbo Natale un uomo nudo.,"['Raz Degan', ' Marco Messeri']",,['patti'],0,0,0,1,0,0,0,0,0,0,0,0,0,0,0,0,0,0,0,0,0,0,0,0,0,Regalo per Patti Patti chiede a Babbo Natale un uomo nudo.
483,2,7,Quiz di Natale,Paolo e Ilaria sono scelti per partecipare a un quiz televisivo.,['Amadeus'],,"['paolo', 'ilaria']",0,1,0,0,0,0,0,0,0,0,0,0,0,0,0,0,0,0,0,1,0,0,0,0,0,Quiz di Natale Paolo e Ilaria sono scelti per partecipare a un quiz televisivo.
484,2,8,Carta da regalo,De Marinis chiede a Luca di impacchettare i regali di Natale per i dipendenti.,,,"['luca', 'de marinis']",1,0,0,0,0,0,0,0,0,0,0,0,1,0,0,0,0,0,0,0,0,0,0,0,0,Carta da regalo De Marinis chiede a Luca di impacchettare i regali di Natale per i dipendenti.
485,2,9,Babbo Natale,De Marinis non vuole che il Babbo Natale dell'Azienda sia impersonato da un ragazzo di colore.,['Obafemi Martins'],,['de marinis'],0,0,0,0,0,0,0,0,0,0,0,0,1,0,0,0,0,0,0,0,0,0,0,0,0,Babbo Natale De Marinis non vuole che il Babbo Natale dell'Azienda sia impersonato da un ragazzo di colore.
486,2,10,Il suicidio di Anna,"Anna riceve una lettera di licenziamento al posto degli auguri di Natale del Presidente e così decide di suicidarsi, ma nessuno la prende sul serio.",,,['anna'],0,0,0,0,0,0,0,0,0,0,1,0,0,0,0,0,0,0,0,0,0,0,0,0,0,"Il suicidio di Anna Anna riceve una lettera di licenziamento al posto degli auguri di Natale del Presidente e così decide di suicidarsi, ma nessuno la prende sul serio."
487,2,11,Lo show dei bambini,Luca diventa giudice del concorso canoro per i figli dei dipendenti. Paolo e Anna cercano di corromperlo per garantire la vittoria ai rispettivi figli.,,,"['luca', 'paolo', 'anna']",1,1,0,0,0,0,0,0,0,0,1,0,0,0,0,0,0,0,0,0,0,0,0,0,0,Lo show dei bambini Luca diventa giudice del concorso canoro per i figli dei dipendenti. Paolo e Anna cercano di corromperlo per garantire la vittoria ai rispettivi figli.
488,2,12,La busta di Natale,"Loredana cerca di ottenere anche lei, come gli altri dipendenti dell'azienda, una gratifica natalizia, ricattando Paolo, Luca e persino De Marinis.",['Silvia Giordano'],,"['luca', 'paolo', 'de marinis']",1,1,0,0,0,0,0,0,0,0,0,0,1,0,0,0,0,0,0,0,0,0,0,0,0,"La busta di Natale Loredana cerca di ottenere anche lei, come gli altri dipendenti dell'azienda, una gratifica natalizia, ricattando Paolo, Luca e persino De Marinis."
489,2,13,Il Babbo Natale di Patti,"Patti porta in ufficio un Babbo Natale meccanico, ma Luca non lo sopporta, soprattutto perché, per alimentarlo, non possono più usare la macchinetta del caffè.",,,"['luca', 'patti']",1,0,0,1,0,0,0,0,0,0,0,0,0,0,0,0,0,0,0,0,0,0,0,0,0,"Il Babbo Natale di Patti Patti porta in ufficio un Babbo Natale meccanico, ma Luca non lo sopporta, soprattutto perché, per alimentarlo, non possono più usare la macchinetta del caffè."
490,2,14,Vigilia di Natale[1],"Dopo aver litigato con Valeria, Paolo si ritrova fuori di casa la notte di Natale: a fargli compagnia in Azienda trova Luca, Anna e Patti.",,,"['luca', 'paolo', 'patti', 'anna', 'valeria']",1,1,0,1,0,0,0,0,0,0,1,0,0,0,0,0,0,0,0,0,1,0,0,0,0,"Vigilia di Natale[1] Dopo aver litigato con Valeria, Paolo si ritrova fuori di casa la notte di Natale: a fargli compagnia in Azienda trova Luca, Anna e Patti."
491,2,15,Natale in famiglia,Luca e Paolo si impietosiscono credendo che Pippo abbia passato le feste natalizie da solo.,,,"['luca', 'paolo', 'pippo']",1,1,0,0,0,0,0,0,0,0,0,0,0,0,0,0,1,0,0,0,0,0,0,0,0,Natale in famiglia Luca e Paolo si impietosiscono credendo che Pippo abbia passato le feste natalizie da solo.
492,2,16,Cosa fai a capodanno?,I dipendenti si organizzano per il capodanno.,,,[],0,0,0,0,0,0,0,0,0,0,0,0,0,0,0,0,0,0,0,0,0,0,0,0,0,Cosa fai a capodanno? I dipendenti si organizzano per il capodanno.
493,2,17,Vestito da sera,Ilaria fa invitare Gaia alla festa di capodanno del presidente.,,,"['gaia', 'ilaria']",0,0,0,0,0,0,0,0,0,0,0,0,0,0,0,0,0,1,0,1,0,0,0,0,0,Vestito da sera Ilaria fa invitare Gaia alla festa di capodanno del presidente.
494,2,18,Buon anno[2],Alcuni dipendenti si ritrovano in area relax per festeggiare il Capodanno.,,,[],0,0,0,0,0,0,0,0,0,0,0,0,0,0,0,0,0,0,0,0,0,0,0,0,0,Buon anno[2] Alcuni dipendenti si ritrovano in area relax per festeggiare il Capodanno.
495,2,19,Tra donne,"Dopo l'ennesima delusione sentimentale, Anna si convince di essere lesbica.",,,['anna'],0,0,0,0,0,0,0,0,0,0,1,0,0,0,0,0,0,0,0,0,0,0,0,0,0,"Tra donne Dopo l'ennesima delusione sentimentale, Anna si convince di essere lesbica."
496,2,20,Il sorriso,Ultimamente De Marinis è sempre sorridente e Luca e Paolo sospettano che ci sia sotto qualcosa.,,,"['luca', 'paolo', 'de marinis']",1,1,0,0,0,0,0,0,0,0,0,0,1,0,0,0,0,0,0,0,0,0,0,0,0,Il sorriso Ultimamente De Marinis è sempre sorridente e Luca e Paolo sospettano che ci sia sotto qualcosa.
497,2,21,Il pompiere,Patti fa un disastro con l'estintore e il pompiere che arriva in soccorso in Azienda impone a De Marinis che uno dei suoi dipendenti debba seguire il corso da pompiere.,['Giampiero Bartolini'],,"['patti', 'de marinis']",0,0,0,1,0,0,0,0,0,0,0,0,1,0,0,0,0,0,0,0,0,0,0,0,0,Il pompiere Patti fa un disastro con l'estintore e il pompiere che arriva in soccorso in Azienda impone a De Marinis che uno dei suoi dipendenti debba seguire il corso da pompiere.
498,2,22,Il cugino d'America,Luca convince un suo cugino americano di non avere un soldo per non ospitarlo a casa sua.,['Tyler White'],,['luca'],1,0,0,0,0,0,0,0,0,0,0,0,0,0,0,0,0,0,0,0,0,0,0,0,0,Il cugino d'America Luca convince un suo cugino americano di non avere un soldo per non ospitarlo a casa sua.
499,2,23,Giustizia fai da te,Luca e Paolo hanno tamponato la stessa macchina.,,,"['luca', 'paolo']",1,1,0,0,0,0,0,0,0,0,0,0,0,0,0,0,0,0,0,0,0,0,0,0,0,Giustizia fai da te Luca e Paolo hanno tamponato la stessa macchina.
500,2,24,Peccati di gioventù,In ufficio si diffondono alcune foto che ritraggono una ragazza nuda identica ad Anna e così tutti cominciano a essere gentili con lei.,,,['anna'],0,0,0,0,0,0,0,0,0,0,1,0,0,0,0,0,0,0,0,0,0,0,0,0,0,Peccati di gioventù In ufficio si diffondono alcune foto che ritraggono una ragazza nuda identica ad Anna e così tutti cominciano a essere gentili con lei.
501,2,25,Tanti auguri Paolo,In ufficio viene organizzata una festa a sorpresa per Paolo.,['Soria Monica Velasco'],,['paolo'],0,1,0,0,0,0,0,0,0,0,0,0,0,0,0,0,0,0,0,0,0,0,0,0,0,Tanti auguri Paolo In ufficio viene organizzata una festa a sorpresa per Paolo.
502,2,26,Download illegale,Olmo avvisa il Direttore che la guardia di finanza sta arrivando per controllare tutti i file dei PC aziendali.,"['Pietro Pignatelli', ' Renato Soriano']",,['olmo'],0,0,0,0,0,1,0,0,0,0,0,0,0,0,0,0,0,0,0,0,0,0,0,0,0,Download illegale Olmo avvisa il Direttore che la guardia di finanza sta arrivando per controllare tutti i file dei PC aziendali.
503,2,27,Il test di Luca,Luca attende i risultati del test dell'AIDS.,,,['luca'],1,0,0,0,0,0,0,0,0,0,0,0,0,0,0,0,0,0,0,0,0,0,0,0,0,Il test di Luca Luca attende i risultati del test dell'AIDS.
504,2,28,Il prosciutto,"Luca, Paolo e Pippo organizzano uno stratagemma ai danni di Silvano per farsi prestare € 2000.",,,"['luca', 'paolo', 'silvano', 'emma', 'pippo']",1,1,0,0,1,0,0,0,0,0,0,1,0,0,0,0,1,0,0,0,0,0,0,0,0,"Il prosciutto Luca, Paolo e Pippo organizzano uno stratagemma ai danni di Silvano per farsi prestare € 2000."
505,2,29,Pirobazia,Jessica fa mettere in ufficio dei carboni ardenti.,,,['jessica'],0,0,0,0,0,0,0,0,0,0,0,0,0,0,0,0,0,0,1,0,0,0,0,0,0,Pirobazia Jessica fa mettere in ufficio dei carboni ardenti.
506,2,30,L'isola della tentazione,"Luca, Alex, Patti e Silvano fanno un provino per un reality show.",,,"['luca', 'patti', 'silvano', 'alex']",1,0,0,1,1,0,0,1,0,0,0,0,0,0,0,0,0,0,0,0,0,0,0,0,0,"L'isola della tentazione Luca, Alex, Patti e Silvano fanno un provino per un reality show."
507,2,31,Genitore ideale,"Paolo ha paura che Valeria possa chiedere l'affidamento esclusivo dei figli, così chiede al dottor Cestelli di aiutarlo a superare gli eventuali test psicologici sulla sua personalità.",['Paolo Pierobon'],,"['paolo', 'valeria']",0,1,0,0,0,0,0,0,0,0,0,0,0,0,0,0,0,0,0,0,1,0,0,0,0,"Genitore ideale Paolo ha paura che Valeria possa chiedere l'affidamento esclusivo dei figli, così chiede al dottor Cestelli di aiutarlo a superare gli eventuali test psicologici sulla sua personalità."
508,2,32,La moneta,"Luca e Paolo vogliono prendersi un caffè, ma sono senza monete.",['Bedy Moratti'],,"['luca', 'paolo']",1,1,0,0,0,0,0,0,0,0,0,0,0,0,0,0,0,0,0,0,0,0,0,0,0,"La moneta Luca e Paolo vogliono prendersi un caffè, ma sono senza monete."
509,2,33,Pianta carnivora,De Marinis porta in ufficio la pianta carnivora di sua moglie.,,,['de marinis'],0,0,0,0,0,0,0,0,0,0,0,0,1,0,0,0,0,0,0,0,0,0,0,0,0,Pianta carnivora De Marinis porta in ufficio la pianta carnivora di sua moglie.
510,2,34,Cantina De Marinis,"Luca e Paolo, incaricati di prelevare il vino di De Marinis, lo scambiano col vino della mensa, convinti che il direttore non si accorgerà di nulla.",,,"['luca', 'paolo', 'de marinis']",1,1,0,0,0,0,0,0,0,0,0,0,1,0,0,0,0,0,0,0,0,0,0,0,0,"Cantina De Marinis Luca e Paolo, incaricati di prelevare il vino di De Marinis, lo scambiano col vino della mensa, convinti che il direttore non si accorgerà di nulla."
511,2,35,Mezzogiorno di fuoco,Silvano ha deciso di sfidare Andrea una volta per tutte.,,,"['silvano', 'andrea']",0,0,0,0,1,0,0,0,0,0,0,0,0,1,0,0,0,0,0,0,0,0,0,0,0,Mezzogiorno di fuoco Silvano ha deciso di sfidare Andrea una volta per tutte.
512,2,36,Rifugio antiatomico,"Luca eredita un vecchio rifugio antiatomico, ma non sa scegliere se dividerlo, in caso di emergenza, con Paolo oppure Alex.",,,"['luca', 'paolo', 'alex']",1,1,0,0,0,0,0,1,0,0,0,0,0,0,0,0,0,0,0,0,0,0,0,0,0,"Rifugio antiatomico Luca eredita un vecchio rifugio antiatomico, ma non sa scegliere se dividerlo, in caso di emergenza, con Paolo oppure Alex."
513,2,37,Torta pesante,"Patti prepara per la madre di Silvano una torta piena di sonniferi, ma i suoi colleghi la intercettano.",['Massimo Cagnina'],,"['patti', 'silvano']",0,0,0,1,1,0,0,0,0,0,0,0,0,0,0,0,0,0,0,0,0,0,0,0,0,"Torta pesante Patti prepara per la madre di Silvano una torta piena di sonniferi, ma i suoi colleghi la intercettano."
514,2,38,L'operazione,Luca deve operarsi di calcoli renali ma i colleghi lo spaventano con tremendi racconti di malasanità.,['Giuseppe Lorusso'],,['luca'],1,0,0,0,0,0,0,0,0,0,0,0,0,0,0,0,0,0,0,0,0,0,0,0,0,L'operazione Luca deve operarsi di calcoli renali ma i colleghi lo spaventano con tremendi racconti di malasanità.
515,2,39,Bioterrorismo,Luca e Paolo voglio far ammalare Ilaria per non dover svolgere una pratica.,,,"['luca', 'paolo', 'ilaria']",1,1,0,0,0,0,0,0,0,0,0,0,0,0,0,0,0,0,0,1,0,0,0,0,0,Bioterrorismo Luca e Paolo voglio far ammalare Ilaria per non dover svolgere una pratica.
516,2,40,Vendetta,Paolo ha un problema con un cliente danese.,['Uberto Kovacevich'],,['paolo'],0,1,0,0,0,0,0,0,0,0,0,0,0,0,0,0,0,0,0,0,0,0,0,0,0,Vendetta Paolo ha un problema con un cliente danese.
517,2,41,Emergenza casa,Olmo è stato sfrattato e non ha un posto in cui andare a vivere.,,,['olmo'],0,0,0,0,0,1,0,0,0,0,0,0,0,0,0,0,0,0,0,0,0,0,0,0,0,Emergenza casa Olmo è stato sfrattato e non ha un posto in cui andare a vivere.
518,2,42,Luca geloso,Luca sospetta che Alex lo voglia tradire.,['Alessandro Politi'],,"['luca', 'alex']",1,0,0,0,0,0,0,1,0,0,0,0,0,0,0,0,0,0,0,0,0,0,0,0,0,Luca geloso Luca sospetta che Alex lo voglia tradire.
519,2,43,Imborghesito,Luca viene accusato dai colleghi di essersi imborghesito.,,,['luca'],1,0,0,0,0,0,0,0,0,0,0,0,0,0,0,0,0,0,0,0,0,0,0,0,0,Imborghesito Luca viene accusato dai colleghi di essersi imborghesito.
520,2,44,Saldi,Paolo trova una valigia nel parcheggio e lui e Luca vendono gli abiti contenuti all'interno alle colleghe dell'ufficio.,,,"['luca', 'paolo']",1,1,0,0,0,0,0,0,0,0,0,0,0,0,0,0,0,0,0,0,0,0,0,0,0,Saldi Paolo trova una valigia nel parcheggio e lui e Luca vendono gli abiti contenuti all'interno alle colleghe dell'ufficio.
521,2,45,La catena dell'umiliazione,"Caduta vittima di una catena di Sant'Antonio, Anna inizia a umiliarsi in svariati modi, nonostante Luca cerchi di dissuaderla.",,,"['luca', 'anna']",1,0,0,0,0,0,0,0,0,0,1,0,0,0,0,0,0,0,0,0,0,0,0,0,0,"La catena dell'umiliazione Caduta vittima di una catena di Sant'Antonio, Anna inizia a umiliarsi in svariati modi, nonostante Luca cerchi di dissuaderla."
522,2,46,Il papà di Silvano,Luca e Paolo si convincono che De Marinis sia il padre di Silvano.,['Eric Claire'],,"['luca', 'paolo', 'silvano', 'de marinis']",1,1,0,0,1,0,0,0,0,0,0,0,1,0,0,0,0,0,0,0,0,0,0,0,0,Il papà di Silvano Luca e Paolo si convincono che De Marinis sia il padre di Silvano.
523,2,47,Pietà,Andrea porta Pietà in ufficio.,,,['andrea'],0,0,0,0,0,0,0,0,0,0,0,0,0,1,0,0,0,0,0,0,0,0,0,0,0,Pietà Andrea porta Pietà in ufficio.
524,2,48,Per carità,De Marinis organizza una raccolta di vestiti usati da spedire a un istituto per ciechi.,,,['de marinis'],0,0,0,0,0,0,0,0,0,0,0,0,1,0,0,0,0,0,0,0,0,0,0,0,0,Per carità De Marinis organizza una raccolta di vestiti usati da spedire a un istituto per ciechi.
525,2,49,Brufolo,A Patti cresce un brufolo enorme sulla fronte e accetta diversi consigli dei colleghi su come sgonfiarlo.,,,['patti'],0,0,0,1,0,0,0,0,0,0,0,0,0,0,0,0,0,0,0,0,0,0,0,0,0,Brufolo A Patti cresce un brufolo enorme sulla fronte e accetta diversi consigli dei colleghi su come sgonfiarlo.
526,2,50,Fotografia ritoccata,Olmo e Paolo si divertono a ritoccare delle foto con il computer.,,,"['paolo', 'olmo']",0,1,0,0,0,1,0,0,0,0,0,0,0,0,0,0,0,0,0,0,0,0,0,0,0,Fotografia ritoccata Olmo e Paolo si divertono a ritoccare delle foto con il computer.
527,2,51,Le scarpe,Olmo compra on-line delle scarpe per Andrea.,['Roberto De Sano'],,"['olmo', 'andrea']",0,0,0,0,0,1,0,0,0,0,0,0,0,1,0,0,0,0,0,0,0,0,0,0,0,Le scarpe Olmo compra on-line delle scarpe per Andrea.
528,2,52,Test di fertilità,Luca scopre di essere ipospermico.,,,['luca'],1,0,0,0,0,0,0,0,0,0,0,0,0,0,0,0,0,0,0,0,0,0,0,0,0,Test di fertilità Luca scopre di essere ipospermico.
529,2,53,Concorso di cabaret,"Silvano sta per partecipare a un concorso di cabaret e, per allenarsi, si esibisce davanti ai colleghi.",,,['silvano'],0,0,0,0,1,0,0,0,0,0,0,0,0,0,0,0,0,0,0,0,0,0,0,0,0,"Concorso di cabaret Silvano sta per partecipare a un concorso di cabaret e, per allenarsi, si esibisce davanti ai colleghi."
530,2,54,Lezione di inglese,Jessica deve insegnare l'inglese a Paolo.,['Cecilia Vecchio'],,"['paolo', 'jessica']",0,1,0,0,0,0,0,0,0,0,0,0,0,0,0,0,0,0,1,0,0,0,0,0,0,Lezione di inglese Jessica deve insegnare l'inglese a Paolo.
531,2,55,Watergate,Luca e Paolo giocano col baby monitor di Primo.,,,"['luca', 'paolo']",1,1,0,0,0,0,0,0,0,0,0,0,0,0,0,0,0,0,0,0,0,0,0,0,0,Watergate Luca e Paolo giocano col baby monitor di Primo.
532,2,56,Agenzia cuori solitari,Alex scopre che Luca si è iscritto a un'agenzia matrimoniale e gli organizza un appuntamento indimenticabile.,,,"['luca', 'alex']",1,0,0,0,0,0,0,1,0,0,0,0,0,0,0,0,0,0,0,0,0,0,0,0,0,Agenzia cuori solitari Alex scopre che Luca si è iscritto a un'agenzia matrimoniale e gli organizza un appuntamento indimenticabile.
533,2,57,Un solo colpevole,Ilaria è infuriata perché nessuno ha ancora presentato l'ordine per ricevere le materie prime.,,,['ilaria'],0,0,0,0,0,0,0,0,0,0,0,0,0,0,0,0,0,0,0,1,0,0,0,0,0,Un solo colpevole Ilaria è infuriata perché nessuno ha ancora presentato l'ordine per ricevere le materie prime.
534,2,58,Pupazzetti,Paolo cerca di vendere ai suoi colleghi dei pupazzetti.,['Silvia Giordano'],,['paolo'],0,1,0,0,0,0,0,0,0,0,0,0,0,0,0,0,0,0,0,0,0,0,0,0,0,Pupazzetti Paolo cerca di vendere ai suoi colleghi dei pupazzetti.
535,2,59,La paura,Luca e Paolo leggono su una rivista che un forte spavento può far aumentare il desiderio sessuale.,,,"['luca', 'paolo']",1,1,0,0,0,0,0,0,0,0,0,0,0,0,0,0,0,0,0,0,0,0,0,0,0,La paura Luca e Paolo leggono su una rivista che un forte spavento può far aumentare il desiderio sessuale.
536,2,60,Step tonico,Jessica organizza un piccolo corso di aerobica.,,,['jessica'],0,0,0,0,0,0,0,0,0,0,0,0,0,0,0,0,0,0,1,0,0,0,0,0,0,Step tonico Jessica organizza un piccolo corso di aerobica.
537,2,61,Lotta proletaria,Luca organizza una protesta a favore di un'altra azienda che è stata venduta.,,,['luca'],1,0,0,0,0,0,0,0,0,0,0,0,0,0,0,0,0,0,0,0,0,0,0,0,0,Lotta proletaria Luca organizza una protesta a favore di un'altra azienda che è stata venduta.
538,2,62,Amico traditore,"Paolo e Alex sono andati a letto e hanno il terrore che Luca lo scopra. Luca però sa che Alex ha fatto sesso con qualcuno dell'azienda e ciò lo deprime, perché Alex ha tradito la sua promessa di non fare sesso con i dipendenti dell'azienda.",,,"['luca', 'paolo', 'alex']",1,1,0,0,0,0,0,1,0,0,0,0,0,0,0,0,0,0,0,0,0,0,0,0,0,"Amico traditore Paolo e Alex sono andati a letto e hanno il terrore che Luca lo scopra. Luca però sa che Alex ha fatto sesso con qualcuno dell'azienda e ciò lo deprime, perché Alex ha tradito la sua promessa di non fare sesso con i dipendenti dell'azienda."
539,2,63,Calciatrice,Andrea scommette con Luca e Paolo sull'esito della partita di calcio dove giocherà Patti.,,,"['luca', 'paolo', 'patti', 'andrea']",1,1,0,1,0,0,0,0,0,0,0,0,0,1,0,0,0,0,0,0,0,0,0,0,0,Calciatrice Andrea scommette con Luca e Paolo sull'esito della partita di calcio dove giocherà Patti.
540,2,64,Carica della polizia,Luca organizza uno sciopero e chiede ai colleghi di riprenderne le varie fasi con una videocamera.,,,['luca'],1,0,0,0,0,0,0,0,0,0,0,0,0,0,0,0,0,0,0,0,0,0,0,0,0,Carica della polizia Luca organizza uno sciopero e chiede ai colleghi di riprenderne le varie fasi con una videocamera.
541,2,65,Controfigura,Paolo è nei guai col marito di una sua amante e decide di far calare Silvano nel personaggio.,,,"['paolo', 'silvano']",0,1,0,0,1,0,0,0,0,0,0,0,0,0,0,0,0,0,0,0,0,0,0,0,0,Controfigura Paolo è nei guai col marito di una sua amante e decide di far calare Silvano nel personaggio.
542,2,66,Dita di fata,"Dopo aver scoperto il metodo con cui il medico aziendale intende curare la sciatica del presidente, Luca vorrebbe spargere la notizia in giro, ma verrà messo a tacere da Andrea.",['Paolo Pierobon'],,"['luca', 'andrea']",1,0,0,0,0,0,0,0,0,0,0,0,0,1,0,0,0,0,0,0,0,0,0,0,0,"Dita di fata Dopo aver scoperto il metodo con cui il medico aziendale intende curare la sciatica del presidente, Luca vorrebbe spargere la notizia in giro, ma verrà messo a tacere da Andrea."
543,2,67,I pantaloni di pelle,Luca fa un bellissimo regalo a Paolo.,,,"['luca', 'paolo']",1,1,0,0,0,0,0,0,0,0,0,0,0,0,0,0,0,0,0,0,0,0,0,0,0,I pantaloni di pelle Luca fa un bellissimo regalo a Paolo.
544,2,68,Il capro espiatorio,In ufficio tutti hanno i nervi a fior di pelle a causa della partenza di Silvano per le ferie e De Marinis affida a Nadia il compito di placare le acque.,,,"['silvano', 'de marinis']",0,0,0,0,1,0,0,0,0,0,0,0,1,0,0,0,0,0,0,0,0,0,0,0,0,Il capro espiatorio In ufficio tutti hanno i nervi a fior di pelle a causa della partenza di Silvano per le ferie e De Marinis affida a Nadia il compito di placare le acque.
545,2,69,Il giovane Enrico,"Paolo ha un nuovo stagista, che fa subito carriera e Luca è geloso.",['Marco Cortesi'],,"['luca', 'paolo']",1,1,0,0,0,0,0,0,0,0,0,0,0,0,0,0,0,0,0,0,0,0,0,0,0,"Il giovane Enrico Paolo ha un nuovo stagista, che fa subito carriera e Luca è geloso."
546,2,70,La donna delle pulizie,"Paolo si fa aiutare da Loredana a scegliere il regalo per il compleanno di Gaia, ma non sa che la donna delle pulizie è in malafede.","['Silvia Giordano', ' Manuela Currau']",,"['paolo', 'gaia']",0,1,0,0,0,0,0,0,0,0,0,0,0,0,0,0,0,1,0,0,0,0,0,0,0,"La donna delle pulizie Paolo si fa aiutare da Loredana a scegliere il regalo per il compleanno di Gaia, ma non sa che la donna delle pulizie è in malafede."
547,2,71,La multa,"Anselmo prende una multa, ma non sa come pagarla.",['Massimo Ranieri'],,[],0,0,0,0,0,0,0,0,0,0,0,0,0,0,0,0,0,0,0,0,0,0,0,0,0,"La multa Anselmo prende una multa, ma non sa come pagarla."
548,2,72,L'asciugacapelli,Paolo cerca di riparare il phon di Gaia.,,,"['paolo', 'gaia']",0,1,0,0,0,0,0,0,0,0,0,0,0,0,0,0,0,1,0,0,0,0,0,0,0,L'asciugacapelli Paolo cerca di riparare il phon di Gaia.
549,2,73,Lavori in corso,De Marinis assume due belle imbianchine per ridipingere l'area relax.,"['Lucilla Agosti', ' Francesca Martinez']",,['de marinis'],0,0,0,0,0,0,0,0,0,0,0,0,1,0,0,0,0,0,0,0,0,0,0,0,0,Lavori in corso De Marinis assume due belle imbianchine per ridipingere l'area relax.
550,2,74,Luca abbronzato,"Luca torna dalle vacanze visibilmente abbronzato, ma nessuno dei suoi colleghi se ne accorge.",,,['luca'],1,0,0,0,0,0,0,0,0,0,0,0,0,0,0,0,0,0,0,0,0,0,0,0,0,"Luca abbronzato Luca torna dalle vacanze visibilmente abbronzato, ma nessuno dei suoi colleghi se ne accorge."
551,2,75,Occhio per occhio,Scoppia la guerra tra l'Azienda e la Digitex.,,,[],0,0,0,0,0,0,0,0,0,0,0,0,0,0,0,0,0,0,0,0,0,0,0,0,0,Occhio per occhio Scoppia la guerra tra l'Azienda e la Digitex.
552,2,76,Occhiolino,De Marinis ha un tic in un occhio.,,,['de marinis'],0,0,0,0,0,0,0,0,0,0,0,0,1,0,0,0,0,0,0,0,0,0,0,0,0,Occhiolino De Marinis ha un tic in un occhio.
553,2,77,Scelte nutrizionali,Ilaria si scopre appassionata dei panini del bar di Lello o di chi glieli porta.,['Gualtiero Burzi'],,['ilaria'],0,0,0,0,0,0,0,0,0,0,0,0,0,0,0,0,0,0,0,1,0,0,0,0,0,Scelte nutrizionali Ilaria si scopre appassionata dei panini del bar di Lello o di chi glieli porta.
554,2,78,Scommessa al buio,Paolo e Silvano scommettono su chi esce dall'ascensore.,,,"['paolo', 'silvano']",0,1,0,0,1,0,0,0,0,0,0,0,0,0,0,0,0,0,0,0,0,0,0,0,0,Scommessa al buio Paolo e Silvano scommettono su chi esce dall'ascensore.
555,2,79,Una giornata da star,"Luca ha la possibilità di esprimere il proprio parere in un'intervista televisiva, coinvolgendo Alex e Paolo, ma non tutto va secondo i piani.",['Gianluca Iacono'],,"['luca', 'paolo', 'alex']",1,1,0,0,0,0,0,1,0,0,0,0,0,0,0,0,0,0,0,0,0,0,0,0,0,"Una giornata da star Luca ha la possibilità di esprimere il proprio parere in un'intervista televisiva, coinvolgendo Alex e Paolo, ma non tutto va secondo i piani."
556,2,80,La giraffa,"Paolo, Olmo e Anna devono scegliere il regalo di Natale per i figli da parte dell'azienda.",,,"['paolo', 'olmo', 'anna']",0,1,0,0,0,1,0,0,0,0,1,0,0,0,0,0,0,0,0,0,0,0,0,0,0,"La giraffa Paolo, Olmo e Anna devono scegliere il regalo di Natale per i figli da parte dell'azienda."
557,2,81,Lotteria,"Chiara, la figlia di De Marinis, cerca di rifilare biglietti della lotteria agli impiegati.",['Luciana Littizzetto'],,['de marinis'],0,0,0,0,0,0,0,0,0,0,0,0,1,0,0,0,0,0,0,0,0,0,0,0,0,"Lotteria Chiara, la figlia di De Marinis, cerca di rifilare biglietti della lotteria agli impiegati."
558,2,82,Ragazzo padre,Olmo vuole dimostrare finalmente a tutti che Primo è figlio di Giada De Blanck.,['Massimo Poggio'],,['olmo'],0,0,0,0,0,1,0,0,0,0,0,0,0,0,0,0,0,0,0,0,0,0,0,0,0,Ragazzo padre Olmo vuole dimostrare finalmente a tutti che Primo è figlio di Giada De Blanck.
559,2,83,Alito cattivo,"Paolo deve andare da un cliente assieme a Gaia, ma si accorge di avere l'alito cattivo.",,,"['paolo', 'gaia']",0,1,0,0,0,0,0,0,0,0,0,0,0,0,0,0,0,1,0,0,0,0,0,0,0,"Alito cattivo Paolo deve andare da un cliente assieme a Gaia, ma si accorge di avere l'alito cattivo."
