,season,episodio,titolo,trama,guest_star,prima_visione,tags,luca,paolo,patty,patti,silvano,olmo,gloria,alex,caterina,lucrezia,anna,emma,de marinis,andrea,geller,vittorio,pippo,gaia,jessica,ilaria,valeria,wanda,giovanna,maria eleonara,carminati,title_trama
1340,4,200,Coppia aperta,Olmo ha delle foto di Alex che la ritraggono in situazioni compromettenti.,"['Beatrice Maestrini ', ' Claudio Sterpone']",28 novembre 2007,"['olmo', 'alex']",0,0,0,0,0,1,0,1,0,0,0,0,0,0,0,0,0,0,0,0,0,0,0,0,0,Coppia aperta Olmo ha delle foto di Alex che la ritraggono in situazioni compromettenti.
1341,4,201,Bicchierino speciale,In azienda vengono stampati degli slogan sui bicchierini della macchinetta del caffè.,"['Andrea ""Ahmed"" Orancone']",28 novembre 2007,[],0,0,0,0,0,0,0,0,0,0,0,0,0,0,0,0,0,0,0,0,0,0,0,0,0,Bicchierino speciale In azienda vengono stampati degli slogan sui bicchierini della macchinetta del caffè.
1342,4,202,Attentato,Luca sospetta che l'azienda stia per diventare l'obiettivo di un attentato terroristico.,"['Gianpaolo Gambi ', ' Ajub Elamraoui']",28 novembre 2007,['luca'],1,0,0,0,0,0,0,0,0,0,0,0,0,0,0,0,0,0,0,0,0,0,0,0,0,Attentato Luca sospetta che l'azienda stia per diventare l'obiettivo di un attentato terroristico.
1343,4,203,Appuntamento con John,Luca spia nel cellulare di Alex e scopre che si vede di nascosto con un certo John.,,28 novembre 2007,"['luca', 'alex']",1,0,0,0,0,0,0,1,0,0,0,0,0,0,0,0,0,0,0,0,0,0,0,0,0,Appuntamento con John Luca spia nel cellulare di Alex e scopre che si vede di nascosto con un certo John.
1344,4,204,Analfabeta informatico,"Luca deve sostituire il suo vecchio computer e, per non spendere soldi, architetta insieme ad Olmo uno stratagemma per impossessarsi del nuovo portatile di De Marinis.",,28 novembre 2007,"['luca', 'olmo', 'emma', 'de marinis']",1,0,0,0,0,1,0,0,0,0,0,1,1,0,0,0,0,0,0,0,0,0,0,0,0,"Analfabeta informatico Luca deve sostituire il suo vecchio computer e, per non spendere soldi, architetta insieme ad Olmo uno stratagemma per impossessarsi del nuovo portatile di De Marinis."
1345,4,205,Filodiffusione,Geller fa installare un impianto di filodiffusione in azienda.,,28 novembre 2007,['geller'],0,0,0,0,0,0,0,0,0,0,0,0,0,0,1,0,0,0,0,0,0,0,0,0,0,Filodiffusione Geller fa installare un impianto di filodiffusione in azienda.
1346,4,206,Bicchierino speciale,In azienda vengono stampati degli slogan sui bicchierini della macchinetta del caffè.,"['Andrea ""Ahmed"" Orancone']",2 dicembre 2007,[],0,0,0,0,0,0,0,0,0,0,0,0,0,0,0,0,0,0,0,0,0,0,0,0,0,Bicchierino speciale In azienda vengono stampati degli slogan sui bicchierini della macchinetta del caffè.
1347,4,207,Attentato,Luca sospetta che l'azienda stia per diventare l'obiettivo di un attentato terroristico.,"['Gianpaolo Gambi ', ' Ajub Elamraoui']",2 dicembre 2007,['luca'],1,0,0,0,0,0,0,0,0,0,0,0,0,0,0,0,0,0,0,0,0,0,0,0,0,Attentato Luca sospetta che l'azienda stia per diventare l'obiettivo di un attentato terroristico.
1348,4,208,Appuntamento con John,Luca spia nel cellulare di Alex e scopre che si vede di nascosto con un certo John.,,2 dicembre 2007,"['luca', 'alex']",1,0,0,0,0,0,0,1,0,0,0,0,0,0,0,0,0,0,0,0,0,0,0,0,0,Appuntamento con John Luca spia nel cellulare di Alex e scopre che si vede di nascosto con un certo John.
1349,4,209,Ridere per ridere,Luca e Paolo cercano di far ridere Geller.,,2 dicembre 2007,"['luca', 'paolo', 'geller']",1,1,0,0,0,0,0,0,0,0,0,0,0,0,1,0,0,0,0,0,0,0,0,0,0,Ridere per ridere Luca e Paolo cercano di far ridere Geller.
1350,4,211,Scarpe bagnate,Paolo non sa come asciugare le sue scarpe bagnate.,,2 dicembre 2007,['paolo'],0,1,0,0,0,0,0,0,0,0,0,0,0,0,0,0,0,0,0,0,0,0,0,0,0,Scarpe bagnate Paolo non sa come asciugare le sue scarpe bagnate.
1351,4,212,Uno spasimante per Patti,Un collega della Digitex trova Patti interessante.,['Marco De Giorgi'],2 dicembre 2007,['patti'],0,0,0,1,0,0,0,0,0,0,0,0,0,0,0,0,0,0,0,0,0,0,0,0,0,Uno spasimante per Patti Un collega della Digitex trova Patti interessante.
1352,4,213,Caffè gratis,Luca scopre che la macchinetta è guasta ed eroga caffè gratis.,,2 dicembre 2007,['luca'],1,0,0,0,0,0,0,0,0,0,0,0,0,0,0,0,0,0,0,0,0,0,0,0,0,Caffè gratis Luca scopre che la macchinetta è guasta ed eroga caffè gratis.
1353,4,214,Una poltrona da distruggere,Luca organizza una protesta contro tutti i licenziamenti di De Marinis.,['Fabrizio Lombardo'],2 dicembre 2007,"['luca', 'de marinis']",1,0,0,0,0,0,0,0,0,0,0,0,1,0,0,0,0,0,0,0,0,0,0,0,0,Una poltrona da distruggere Luca organizza una protesta contro tutti i licenziamenti di De Marinis.
1354,4,215,Crisi d'identità,Silvano ha fatto un errore nel bilancio.,,2 dicembre 2007,['silvano'],0,0,0,0,1,0,0,0,0,0,0,0,0,0,0,0,0,0,0,0,0,0,0,0,0,Crisi d'identità Silvano ha fatto un errore nel bilancio.
1355,4,216,Pratiche perdute,Ilaria manda Maria Eleonora alla ricerca di una fantomatica pratica perduta.,,2 dicembre 2007,['ilaria'],0,0,0,0,0,0,0,0,0,0,0,0,0,0,0,0,0,0,0,1,0,0,0,0,0,Pratiche perdute Ilaria manda Maria Eleonora alla ricerca di una fantomatica pratica perduta.
1356,4,217,Suggestione,Luca e Paolo non vogliono credere alle previsioni di Silvano.,,2 dicembre 2007,"['luca', 'paolo', 'silvano']",1,1,0,0,1,0,0,0,0,0,0,0,0,0,0,0,0,0,0,0,0,0,0,0,0,Suggestione Luca e Paolo non vogliono credere alle previsioni di Silvano.
1357,4,218,Brioche,Paolo prepara delle brioche piccanti per la festa di Carminati.,,2 dicembre 2007,"['paolo', 'carminati']",0,1,0,0,0,0,0,0,0,0,0,0,0,0,0,0,0,0,0,0,0,0,0,0,1,Brioche Paolo prepara delle brioche piccanti per la festa di Carminati.
1358,4,219,Cappello rosso,Patti ruba il basco rosso di Maria Eleonora.,,4 dicembre 2007,['patti'],0,0,0,1,0,0,0,0,0,0,0,0,0,0,0,0,0,0,0,0,0,0,0,0,0,Cappello rosso Patti ruba il basco rosso di Maria Eleonora.
1359,4,220,Conversazione,Maria Eleonora cerca di fare amicizia con Alex e Patti.,,4 dicembre 2007,"['patti', 'alex']",0,0,0,1,0,0,0,1,0,0,0,0,0,0,0,0,0,0,0,0,0,0,0,0,0,Conversazione Maria Eleonora cerca di fare amicizia con Alex e Patti.
1360,4,221,I lucchetti dell'amore,Silvano e Patti vogliono usare il monumento della fusione come simbolo del loro amore.,"['Valentina Melis ', ' Arianna Bergamaschi']",4 dicembre 2007,"['patti', 'silvano']",0,0,0,1,1,0,0,0,0,0,0,0,0,0,0,0,0,0,0,0,0,0,0,0,0,I lucchetti dell'amore Silvano e Patti vogliono usare il monumento della fusione come simbolo del loro amore.
1361,4,222,La presentazione,Ilaria e Gaia si contendono un ruolo nel progetto di presentazione delle C-14 alla fiera internazionale.,,4 dicembre 2007,"['gaia', 'ilaria']",0,0,0,0,0,0,0,0,0,0,0,0,0,0,0,0,0,1,0,1,0,0,0,0,0,La presentazione Ilaria e Gaia si contendono un ruolo nel progetto di presentazione delle C-14 alla fiera internazionale.
1362,4,223,La visita di Patti,Patti scopre di non essere più vergine.,,4 dicembre 2007,['patti'],0,0,0,1,0,0,0,0,0,0,0,0,0,0,0,0,0,0,0,0,0,0,0,0,0,La visita di Patti Patti scopre di non essere più vergine.
1363,4,224,Olmo a rischio,Olmo pensa di essere a rischio licenziamento.,,4 dicembre 2007,['olmo'],0,0,0,0,0,1,0,0,0,0,0,0,0,0,0,0,0,0,0,0,0,0,0,0,0,Olmo a rischio Olmo pensa di essere a rischio licenziamento.
1364,4,225,Paranoie femminili,Luca ed Alex litigano il giorno del loro anniversario.,['Alex Sassatelli'],4 dicembre 2007,"['luca', 'alex']",1,0,0,0,0,0,0,1,0,0,0,0,0,0,0,0,0,0,0,0,0,0,0,0,0,Paranoie femminili Luca ed Alex litigano il giorno del loro anniversario.
1365,4,226,Pratica fantasma,Ilaria crede che Maria Eleonora voglia sabotare il suo lavoro.,,10 dicembre 2007,['ilaria'],0,0,0,0,0,0,0,0,0,0,0,0,0,0,0,0,0,0,0,1,0,0,0,0,0,Pratica fantasma Ilaria crede che Maria Eleonora voglia sabotare il suo lavoro.
1366,4,227,Mattoncini,Geller ordina ai dipendenti dell'azienda e della Digitex di creare insieme un monumento che simboleggi la fusione tra le due aziende.,,10 dicembre 2007,['geller'],0,0,0,0,0,0,0,0,0,0,0,0,0,0,1,0,0,0,0,0,0,0,0,0,0,Mattoncini Geller ordina ai dipendenti dell'azienda e della Digitex di creare insieme un monumento che simboleggi la fusione tra le due aziende.
1367,4,228,Come due sconosciuti,Patti e Silvano rivivono il loro primo incontro.,,10 dicembre 2007,"['patti', 'silvano']",0,0,0,1,1,0,0,0,0,0,0,0,0,0,0,0,0,0,0,0,0,0,0,0,0,Come due sconosciuti Patti e Silvano rivivono il loro primo incontro.
1368,4,229,Colpevoli,Nel bagno privato del Presidente viene scritto un insulto. Geller viene incaricato di trovare il colpevole.,,10 dicembre 2007,['geller'],0,0,0,0,0,0,0,0,0,0,0,0,0,0,1,0,0,0,0,0,0,0,0,0,0,Colpevoli Nel bagno privato del Presidente viene scritto un insulto. Geller viene incaricato di trovare il colpevole.
1369,4,230,Ansia da prestazione,Patti si prepara per una serata con Silvano.,,10 dicembre 2007,"['patti', 'silvano']",0,0,0,1,1,0,0,0,0,0,0,0,0,0,0,0,0,0,0,0,0,0,0,0,0,Ansia da prestazione Patti si prepara per una serata con Silvano.
1370,4,231,Aria di promozione,"De Marinis convince Paolo che, se si comporterà bene, potrebbe avere una promozione.",,10 dicembre 2007,"['paolo', 'de marinis']",0,1,0,0,0,0,0,0,0,0,0,0,1,0,0,0,0,0,0,0,0,0,0,0,0,"Aria di promozione De Marinis convince Paolo che, se si comporterà bene, potrebbe avere una promozione."
1371,4,232,Bambina sparita,Patti perde una bambina della nursery aziendale.,['Gaia ed Eva'],10 dicembre 2007,['patti'],0,0,0,1,0,0,0,0,0,0,0,0,0,0,0,0,0,0,0,0,0,0,0,0,0,Bambina sparita Patti perde una bambina della nursery aziendale.
1372,4,233,Cammina tra noi,In azienda si sparge la voce che il Nuovo Presidente si travesta e venga a spiare i dipendenti in incognito.,['Gianni Bissaca'],10 dicembre 2007,[],0,0,0,0,0,0,0,0,0,0,0,0,0,0,0,0,0,0,0,0,0,0,0,0,0,Cammina tra noi In azienda si sparge la voce che il Nuovo Presidente si travesta e venga a spiare i dipendenti in incognito.
1373,4,234,Il nuovo presidente,De Marinis organizza la festa per l'arrivo in azienda del nuovo presidente.,['Leonardo Lapomarda'],10 dicembre 2007,['de marinis'],0,0,0,0,0,0,0,0,0,0,0,0,1,0,0,0,0,0,0,0,0,0,0,0,0,Il nuovo presidente De Marinis organizza la festa per l'arrivo in azienda del nuovo presidente.
1374,4,235,Il tesoro,Luca e Silvano scoprono una mappa che porta ad un tesoro nascosto in azienda.,,10 dicembre 2007,"['luca', 'silvano']",1,0,0,0,1,0,0,0,0,0,0,0,0,0,0,0,0,0,0,0,0,0,0,0,0,Il tesoro Luca e Silvano scoprono una mappa che porta ad un tesoro nascosto in azienda.
1375,4,236,La mancia,Luca e Maria Eleonora si battono contro De Marinis per far avere la mancia ad un fattorino.,['Daniele Gaggianese'],10 dicembre 2007,"['luca', 'de marinis']",1,0,0,0,0,0,0,0,0,0,0,0,1,0,0,0,0,0,0,0,0,0,0,0,0,La mancia Luca e Maria Eleonora si battono contro De Marinis per far avere la mancia ad un fattorino.
1376,4,237,L'interrogatorio di De Marinis,De Marinis vuole scoprire perché la sera precedente nessuno è andato a prenderlo in macchina.,,15 dicembre 2007,['de marinis'],0,0,0,0,0,0,0,0,0,0,0,0,1,0,0,0,0,0,0,0,0,0,0,0,0,L'interrogatorio di De Marinis De Marinis vuole scoprire perché la sera precedente nessuno è andato a prenderlo in macchina.
1377,4,238,L'ultimo caffè,Paolo e Carminati si contendono l'ultimo caffè della macchinetta.,,15 dicembre 2007,"['paolo', 'carminati']",0,1,0,0,0,0,0,0,0,0,0,0,0,0,0,0,0,0,0,0,0,0,0,0,1,L'ultimo caffè Paolo e Carminati si contendono l'ultimo caffè della macchinetta.
1378,4,239,Visita di controllo,Luca ha paura che si scopra che si è inventato l'infarto.,,15 dicembre 2007,['luca'],1,0,0,0,0,0,0,0,0,0,0,0,0,0,0,0,0,0,0,0,0,0,0,0,0,Visita di controllo Luca ha paura che si scopra che si è inventato l'infarto.
1379,4,241,Il momento giusto,"Olmo deve chiedere un aumento, e Luca gli consiglia di aspettare il momento giusto.",,15 dicembre 2007,"['luca', 'olmo']",1,0,0,0,0,1,0,0,0,0,0,0,0,0,0,0,0,0,0,0,0,0,0,0,0,"Il momento giusto Olmo deve chiedere un aumento, e Luca gli consiglia di aspettare il momento giusto."
1380,4,242,La parabola delle trote,"Geller racconta un'incomprensibile parabola a Luca, il quale fa di tutto per scoprirne il significato.",,15 dicembre 2007,"['luca', 'geller']",1,0,0,0,0,0,0,0,0,0,0,0,0,0,1,0,0,0,0,0,0,0,0,0,0,"La parabola delle trote Geller racconta un'incomprensibile parabola a Luca, il quale fa di tutto per scoprirne il significato."
1381,4,243,Notte insieme,"Patti e Silvano sono convinti di aver passato la notte insieme, ma non si ricordano precisamente cosa sia successo.",,15 dicembre 2007,"['patti', 'silvano']",0,0,0,1,1,0,0,0,0,0,0,0,0,0,0,0,0,0,0,0,0,0,0,0,0,"Notte insieme Patti e Silvano sono convinti di aver passato la notte insieme, ma non si ricordano precisamente cosa sia successo."
1382,4,244,Sogno o realtà,Luca e Paolo decidono di trasformare in realtà un sogno ricorrente di Patti.,,15 dicembre 2007,"['luca', 'paolo', 'patti']",1,1,0,1,0,0,0,0,0,0,0,0,0,0,0,0,0,0,0,0,0,0,0,0,0,Sogno o realtà Luca e Paolo decidono di trasformare in realtà un sogno ricorrente di Patti.
1383,4,245,Tutti frutti,Carminati prepara una macedonia e Luca e Paolo vogliono sabotarla.,,15 dicembre 2007,"['luca', 'paolo', 'carminati']",1,1,0,0,0,0,0,0,0,0,0,0,0,0,0,0,0,0,0,0,0,0,0,0,1,Tutti frutti Carminati prepara una macedonia e Luca e Paolo vogliono sabotarla.
1384,4,246,Cornuto,Luca fa credere ad Alex di avere avuto una storia con la moglie di un collega.,"['Giovanni Tomassetti ', ' Michela Ottolini']",15 dicembre 2007,"['luca', 'alex']",1,0,0,0,0,0,0,1,0,0,0,0,0,0,0,0,0,0,0,0,0,0,0,0,0,Cornuto Luca fa credere ad Alex di avere avuto una storia con la moglie di un collega.
1385,4,247,I baffi di De Marinis,"Durante una vacanza, De Marinis si è fatto crescere i baffi, ma nessuno dei suoi dipendenti sembra accorgersene.",,15 dicembre 2007,['de marinis'],0,0,0,0,0,0,0,0,0,0,0,0,1,0,0,0,0,0,0,0,0,0,0,0,0,"I baffi di De Marinis Durante una vacanza, De Marinis si è fatto crescere i baffi, ma nessuno dei suoi dipendenti sembra accorgersene."
1386,4,248,La cavia,"Patti crede che Geller voglia usare una cavia per degli esperimenti, così cerca di salvarla.",,15 dicembre 2007,"['patti', 'geller']",0,0,0,1,0,0,0,0,0,0,0,0,0,0,1,0,0,0,0,0,0,0,0,0,0,"La cavia Patti crede che Geller voglia usare una cavia per degli esperimenti, così cerca di salvarla."
1387,4,249,La poltrona di Silvano,Luca e Paolo vogliono letteralmente incollare Silvano alla sua nuova poltrona.,,20 dicembre 2007,"['luca', 'paolo', 'silvano']",1,1,0,0,1,0,0,0,0,0,0,0,0,0,0,0,0,0,0,0,0,0,0,0,0,La poltrona di Silvano Luca e Paolo vogliono letteralmente incollare Silvano alla sua nuova poltrona.
1388,4,250,Le piante di Valeria,Valeria chiede a Paolo di prendersi cura delle sue piante mentre lei è fuori città.,,20 dicembre 2007,"['paolo', 'valeria']",0,1,0,0,0,0,0,0,0,0,0,0,0,0,0,0,0,0,0,0,1,0,0,0,0,Le piante di Valeria Valeria chiede a Paolo di prendersi cura delle sue piante mentre lei è fuori città.
1389,4,251,Mai dire Weil,"Carminati incontra un suo ex collega, che sembra se la passi male.",['Massimo Malagugini'],20 dicembre 2007,['carminati'],0,0,0,0,0,0,0,0,0,0,0,0,0,0,0,0,0,0,0,0,0,0,0,0,1,"Mai dire Weil Carminati incontra un suo ex collega, che sembra se la passi male."
1390,4,252,Vendicami,Luca e Paolo distruggono una pratica di Patti e lei chiede a Silvano di vendicarla.,,20 dicembre 2007,"['luca', 'paolo', 'patti', 'silvano']",1,1,0,1,1,0,0,0,0,0,0,0,0,0,0,0,0,0,0,0,0,0,0,0,0,Vendicami Luca e Paolo distruggono una pratica di Patti e lei chiede a Silvano di vendicarla.
1391,4,253,Week end con Maruska,Paolo è costretto a rinunciare al suo weekend con Maruska.,,20 dicembre 2007,['paolo'],0,1,0,0,0,0,0,0,0,0,0,0,0,0,0,0,0,0,0,0,0,0,0,0,0,Week end con Maruska Paolo è costretto a rinunciare al suo weekend con Maruska.
1392,4,254,Cineforum,"Luca, con la scusa del cineforum, tenta di fare colpo su Maria Eleonora.",,20 dicembre 2007,['luca'],1,0,0,0,0,0,0,0,0,0,0,0,0,0,0,0,0,0,0,0,0,0,0,0,0,"Cineforum Luca, con la scusa del cineforum, tenta di fare colpo su Maria Eleonora."
1393,4,255,Il piccolo corteo,Luca vuole assolutamente partecipare al corteo di protesta organizzato da Maria Eleonora.,,20 dicembre 2007,['luca'],1,0,0,0,0,0,0,0,0,0,0,0,0,0,0,0,0,0,0,0,0,0,0,0,0,Il piccolo corteo Luca vuole assolutamente partecipare al corteo di protesta organizzato da Maria Eleonora.
1394,4,256,Il blu scuro e il nero,"Paolo deve vestirsi elegante per un importante contratto, ma non riesce a distinguere tra una giacca blu scuro ed una nera da abbinare ai suoi pantaloni.",,20 dicembre 2007,['paolo'],0,1,0,0,0,0,0,0,0,0,0,0,0,0,0,0,0,0,0,0,0,0,0,0,0,"Il blu scuro e il nero Paolo deve vestirsi elegante per un importante contratto, ma non riesce a distinguere tra una giacca blu scuro ed una nera da abbinare ai suoi pantaloni."
1395,4,257,La barzelletta di Silvano,Silvano cerca di far ridere i colleghi con una barzelletta noiosissima.,,20 dicembre 2007,['silvano'],0,0,0,0,1,0,0,0,0,0,0,0,0,0,0,0,0,0,0,0,0,0,0,0,0,La barzelletta di Silvano Silvano cerca di far ridere i colleghi con una barzelletta noiosissima.
1396,4,258,L'annuncio,Luca vuole vendere un navigatore satellitare rotto.,['Valerio De Feudis'],20 dicembre 2007,['luca'],1,0,0,0,0,0,0,0,0,0,0,0,0,0,0,0,0,0,0,0,0,0,0,0,0,L'annuncio Luca vuole vendere un navigatore satellitare rotto.
1397,4,259,Lili e il vagabondo,Luca lascia a Maria Eleonora un DVD con dentro un messaggio romantico.,['Roland Litrico'],20 dicembre 2007,['luca'],1,0,0,0,0,0,0,0,0,0,0,0,0,0,0,0,0,0,0,0,0,0,0,0,0,Lili e il vagabondo Luca lascia a Maria Eleonora un DVD con dentro un messaggio romantico.
1398,4,260,Offrire,Luca non riesce ad offrire un caffè ai suoi colleghi.,,20 dicembre 2007,['luca'],1,0,0,0,0,0,0,0,0,0,0,0,0,0,0,0,0,0,0,0,0,0,0,0,0,Offrire Luca non riesce ad offrire un caffè ai suoi colleghi.
1399,4,261,Segnaletica orizzontale,"Con la fusione, ed il conseguente spostamento degli uffici, De Marinis crea una nuova segnaletica per meglio orientarsi nel palazzo.","['Paco Carlotto ', ' Alessandro Dinuzzi']",20 dicembre 2007,['de marinis'],0,0,0,0,0,0,0,0,0,0,0,0,1,0,0,0,0,0,0,0,0,0,0,0,0,"Segnaletica orizzontale Con la fusione, ed il conseguente spostamento degli uffici, De Marinis crea una nuova segnaletica per meglio orientarsi nel palazzo."
1400,4,262,Un premio al reparto,Paolo e Carminati non riescono a mettersi d'accordo su quale premio chiedere per il reparto vendite.,,20 dicembre 2007,"['paolo', 'carminati']",0,1,0,0,0,0,0,0,0,0,0,0,0,0,0,0,0,0,0,0,0,0,0,0,1,Un premio al reparto Paolo e Carminati non riescono a mettersi d'accordo su quale premio chiedere per il reparto vendite.
1401,4,263,La prova di Weil,Carminati spiega come valorizzare lo spirito di corpo.,,20 dicembre 2007,['carminati'],0,0,0,0,0,0,0,0,0,0,0,0,0,0,0,0,0,0,0,0,0,0,0,0,1,La prova di Weil Carminati spiega come valorizzare lo spirito di corpo.
1402,4,264,Il litigio,Luca e De Marinis inscenano un finto litigio per non destare in Geller sospetti sui loro intrallazzi.,,20 dicembre 2007,"['luca', 'de marinis', 'geller']",1,0,0,0,0,0,0,0,0,0,0,0,1,0,1,0,0,0,0,0,0,0,0,0,0,Il litigio Luca e De Marinis inscenano un finto litigio per non destare in Geller sospetti sui loro intrallazzi.
1403,4,265,Il video,Luca decide di registrarsi con una videocamera mentre copula con Alex.,,28 dicembre 2007,"['luca', 'alex']",1,0,0,0,0,0,0,1,0,0,0,0,0,0,0,0,0,0,0,0,0,0,0,0,0,Il video Luca decide di registrarsi con una videocamera mentre copula con Alex.
1404,4,266,Mascotte,Geller vuole che venga creata una mascotte per la nuova azienda.,['Andrea Berlinghieri'],28 dicembre 2007,['geller'],0,0,0,0,0,0,0,0,0,0,0,0,0,0,1,0,0,0,0,0,0,0,0,0,0,Mascotte Geller vuole che venga creata una mascotte per la nuova azienda.
1405,4,267,Serialmania,"Per conquistare Maria Eleonora, Luca si finge fan appassionato di una serie televisiva.",,28 dicembre 2007,['luca'],1,0,0,0,0,0,0,0,0,0,0,0,0,0,0,0,0,0,0,0,0,0,0,0,0,"Serialmania Per conquistare Maria Eleonora, Luca si finge fan appassionato di una serie televisiva."
1406,4,268,Sesso con Patti,Paolo ha sognato di andare a letto con Patti.,,28 dicembre 2007,"['paolo', 'patti']",0,1,0,1,0,0,0,0,0,0,0,0,0,0,0,0,0,0,0,0,0,0,0,0,0,Sesso con Patti Paolo ha sognato di andare a letto con Patti.
1407,4,269,Un mese di vita,Vittorio pensa che gli rimanga soltanto un mese da vivere.,,28 dicembre 2007,['vittorio'],0,0,0,0,0,0,0,0,0,0,0,0,0,0,0,1,0,0,0,0,0,0,0,0,0,Un mese di vita Vittorio pensa che gli rimanga soltanto un mese da vivere.
1408,4,271,The voice,"Per fare colpo su una ragazza, Paolo si fa ""prestare"" la voce da un deejay.","['Albertino ', ' Elena Ramogino']",3 gennaio 2008,['paolo'],0,1,0,0,0,0,0,0,0,0,0,0,0,0,0,0,0,0,0,0,0,0,0,0,0,"The voice Per fare colpo su una ragazza, Paolo si fa ""prestare"" la voce da un deejay."
1409,4,272,Momento d'intesa,Patti aiuta Paolo a scrivere un fax.,,3 gennaio 2008,"['paolo', 'patti']",0,1,0,1,0,0,0,0,0,0,0,0,0,0,0,0,0,0,0,0,0,0,0,0,0,Momento d'intesa Patti aiuta Paolo a scrivere un fax.
1410,4,273,Il blog,Geller chiede a Patti di aprire un blog che racconti le vicende dell'azienda.,,3 gennaio 2008,"['patti', 'geller']",0,0,0,1,0,0,0,0,0,0,0,0,0,0,1,0,0,0,0,0,0,0,0,0,0,Il blog Geller chiede a Patti di aprire un blog che racconti le vicende dell'azienda.
1411,4,274,Il fantasma,"Per liberarsi di una sua ex, Paolo le fa credere di essere morto.",['Alessia Marcuzzi'],3 gennaio 2008,['paolo'],0,1,0,0,0,0,0,0,0,0,0,0,0,0,0,0,0,0,0,0,0,0,0,0,0,"Il fantasma Per liberarsi di una sua ex, Paolo le fa credere di essere morto."
1412,4,275,Il ponte,Luca suggerisce a Paolo di simulare un infortunio sul lavoro per passare il ponte insieme.,['Francesco Angeli'],3 gennaio 2008,"['luca', 'paolo']",1,1,0,0,0,0,0,0,0,0,0,0,0,0,0,0,0,0,0,0,0,0,0,0,0,Il ponte Luca suggerisce a Paolo di simulare un infortunio sul lavoro per passare il ponte insieme.
1413,4,276,L'amica del cuore,Patti crede che la nipote della signora Bollini voglia portarle via Silvano.,['Giorgia Palmas'],3 gennaio 2008,"['patti', 'silvano']",0,0,0,1,1,0,0,0,0,0,0,0,0,0,0,0,0,0,0,0,0,0,0,0,0,L'amica del cuore Patti crede che la nipote della signora Bollini voglia portarle via Silvano.
1414,4,277,Il traduttore,Paolo crede che un suo cliente straniero sia arrabbiato con lui per aver ricevuto delle C-14 difettose.,"['Branko Vikich ', ' Emanuele Fortunati']",7 gennaio 2008,['paolo'],0,1,0,0,0,0,0,0,0,0,0,0,0,0,0,0,0,0,0,0,0,0,0,0,0,Il traduttore Paolo crede che un suo cliente straniero sia arrabbiato con lui per aver ricevuto delle C-14 difettose.
1415,4,278,Karate Bitta,Paolo vuole farsi insegnare il karate da un giapponese.,['Tomohiko Tasaka'],7 gennaio 2008,['paolo'],0,1,0,0,0,0,0,0,0,0,0,0,0,0,0,0,0,0,0,0,0,0,0,0,0,Karate Bitta Paolo vuole farsi insegnare il karate da un giapponese.
1416,4,279,La due colori,Paolo vuole lasciare la sua ultima conquista perché ha gli occhi di due colori diversi.,['Martina Colombari'],7 gennaio 2008,['paolo'],0,1,0,0,0,0,0,0,0,0,0,0,0,0,0,0,0,0,0,0,0,0,0,0,0,La due colori Paolo vuole lasciare la sua ultima conquista perché ha gli occhi di due colori diversi.
1417,4,280,Luca baby-sitter,"Per fare colpo su Caterina, Luca si finge baby sitter.",,7 gennaio 2008,"['luca', 'caterina']",1,0,0,0,0,0,0,0,1,0,0,0,0,0,0,0,0,0,0,0,0,0,0,0,0,"Luca baby-sitter Per fare colpo su Caterina, Luca si finge baby sitter."
1418,4,281,Il succhiotto,"Per ingelosire Alex, Luca cerca qualcuno che le faccia un succhiotto.",,7 gennaio 2008,"['luca', 'alex']",1,0,0,0,0,0,0,1,0,0,0,0,0,0,0,0,0,0,0,0,0,0,0,0,0,"Il succhiotto Per ingelosire Alex, Luca cerca qualcuno che le faccia un succhiotto."
1419,4,282,Il tema di italiano,Jonathan ha preso un 8 a scuola e così Paolo cerca di convincere la prof ad abbassare il voto a suo figlio.,['Fioretta Mari'],12 gennaio 2008,['paolo'],0,1,0,0,0,0,0,0,0,0,0,0,0,0,0,0,0,0,0,0,0,0,0,0,0,Il tema di italiano Jonathan ha preso un 8 a scuola e così Paolo cerca di convincere la prof ad abbassare il voto a suo figlio.
1420,4,283,Discriminazione,"L'azienda offre lavoro ad un disabile, ma egli non si inserisce molto bene nell'ambiente, dando molti problemi a Luca e a De Marinis.","['Alex Zanardi ', ' Francesco Randazzo ', ' Gabriele Ciavarra']",12 gennaio 2008,"['luca', 'de marinis']",1,0,0,0,0,0,0,0,0,0,0,0,1,0,0,0,0,0,0,0,0,0,0,0,0,"Discriminazione L'azienda offre lavoro ad un disabile, ma egli non si inserisce molto bene nell'ambiente, dando molti problemi a Luca e a De Marinis."
1421,4,284,L'angelo di Patti,Patti aspetta un segnale dal suo angelo custode.,['Stefano Annoni'],12 gennaio 2008,['patti'],0,0,0,1,0,0,0,0,0,0,0,0,0,0,0,0,0,0,0,0,0,0,0,0,0,L'angelo di Patti Patti aspetta un segnale dal suo angelo custode.
1422,4,285,La grande occasione,Silvano incontra la donna dei suoi sogni.,['Natasha Stefanenko'],12 gennaio 2008,['silvano'],0,0,0,0,1,0,0,0,0,0,0,0,0,0,0,0,0,0,0,0,0,0,0,0,0,La grande occasione Silvano incontra la donna dei suoi sogni.
1423,4,286,La regola,Paolo e Luca hanno una strana regola.,,12 gennaio 2008,"['luca', 'paolo']",1,1,0,0,0,0,0,0,0,0,0,0,0,0,0,0,0,0,0,0,0,0,0,0,0,La regola Paolo e Luca hanno una strana regola.
1424,4,287,L'intervista,"Ilaria deve rilasciare un'intervista per la rivista ""Donna E"" e quindi convince Patti e Wanda a tessere le sue lodi davanti alla giornalista.",['Rosanna Cancellieri'],12 gennaio 2008,"['patti', 'ilaria', 'wanda']",0,0,0,1,0,0,0,0,0,0,0,0,0,0,0,0,0,0,0,1,0,1,0,0,0,"L'intervista Ilaria deve rilasciare un'intervista per la rivista ""Donna E"" e quindi convince Patti e Wanda a tessere le sue lodi davanti alla giornalista."
1425,4,288,Litigare,Luca scommette con Paolo che riesce a far litigare Patti e Silvano entro la fine della giornata.,,17 gennaio 2008,"['luca', 'paolo', 'patti', 'silvano']",1,1,0,1,1,0,0,0,0,0,0,0,0,0,0,0,0,0,0,0,0,0,0,0,0,Litigare Luca scommette con Paolo che riesce a far litigare Patti e Silvano entro la fine della giornata.
1426,4,289,L'uomo di Gaia,"Paolo mette in giro la voce che Riccardo, il fidanzato di Gaia, è gay.",,17 gennaio 2008,"['paolo', 'gaia']",0,1,0,0,0,0,0,0,0,0,0,0,0,0,0,0,0,1,0,0,0,0,0,0,0,"L'uomo di Gaia Paolo mette in giro la voce che Riccardo, il fidanzato di Gaia, è gay."
